id,keyword,location,text,target,sentiment,score
2799,curfew,miami,beginning summer mom made curfew 1 now back 12 can wonders im home,0,POSITIVE,0.994125247001648
2801,curfew,,charlie lim start up sunday curfew let,0,POSITIVE,0.5880421996116638
2802,curfew,hamilton,bombed try 2 home curfew,0,NEGATIVE,0.9585578441619873
2803,cyclone,united kingdom,aww baby walter,0,NEGATIVE,0.942283570766449
2807,cyclone,des moines iowa,big annual football media day heres cyclone hoops recruiting nuggets,1,NEGATIVE,0.5715664625167847
2808,cyclone,usa,new boltåêcyclone dr pp400dr dual outlet power packåêfor external camera flash 30û,0,NEGATIVE,0.9555617570877075
2811,cyclone,rural northern nevada,works purpose large cyclone just dont ok 500,0,NEGATIVE,0.9981204867362976
2813,cyclone,republic philippines,new tropical cyclone forming near gum once formed will called mojave,1,NEGATIVE,0.9519137144088745
2815,cyclone,,video new de justin thomas being cyclone ames tribune ames tribune video new de justin thomas on,0,NEGATIVE,0.9597523808479309
2817,cyclone,,need plants pacific cyclone seasons help,1,NEGATIVE,0.8898303508758545
2819,cyclone,,bac forced retract false claims cyclone pam,1,NEGATIVE,0.9853041768074036
2820,cyclone,,great condition easton cyclone softball bat fastpitch 9 29 sk398,1,NEGATIVE,0.8790189623832703
2821,cyclone,philippines,severe weather bulletin 5 typhoon ûï soudelor tropical cyclone warning issued 500 pm 06,1,NEGATIVE,0.9338600635528564
2822,cyclone,washington dc,cyclone derives powers calm center person norman vincent peace,1,POSITIVE,0.9604564309120178
2825,cyclone,hyderabad,ante hudhud cyclone chandrababu valle ne ante ga,1,NEGATIVE,0.8308376669883728
2826,cyclone,vancouver hq worldwide,cyclone women devastates families mandar week need help today,1,NEGATIVE,0.9767126441001892
2827,cyclone,quezon city philippines,severe weather bulletin tropical cyclone warning typhoon hanna issued 1100 am thursday 06 august,1,NEGATIVE,0.9503680467605591
2828,cyclone,geneva,back future cyclone pam encouraged traditional ways living,1,POSITIVE,0.988737940788269
2829,cyclone,hartford connecticut,bank manager asks tom interview cyclone tom loan given purchase bicycle,0,NEGATIVE,0.9722989201545715
2830,cyclone,sioux falls sd,excited cyclone football,0,POSITIVE,0.9982768297195435
2831,cyclone,cornwall,bac forced retract false claims cyclone pam,1,NEGATIVE,0.9853041768074036
2832,cyclone,basketball,talent misdirection cyclone pass ignite pass vanishing drive phantom shot,1,NEGATIVE,0.98954176902771
2833,cyclone,rome italy,now radio stations broadcasting address upcoming cyclone,1,NEGATIVE,0.9376471042633057
2835,cyclone,tafekop gamatsepe,like cyclone imperialism spins across globe militarism crushes peoples sucks blood like,1,NEGATIVE,0.9839582443237305
2836,cyclone,,1970 mercury cyclone gt hood moulding nice core cobra jet 429cj gt,0,POSITIVE,0.9571242332458496
2838,cyclone,,im cyclone passion overblown,0,NEGATIVE,0.9954537153244019
2839,cyclone,,majesty emperor salman khans unstoppable cyclone entertainment humanity bajrangi bhaijaan creating history crosed 300 cr,0,POSITIVE,0.7180410623550415
2841,cyclone,,1970 mercury cyclone gt quarter panel ds rear trim moulding cobra jet 429cj,1,NEGATIVE,0.9833049774169922
2842,cyclone,,tropical cyclone soudelor 945hpa maximum wind speed 45ms maximum wind gust speed 60ms,1,POSITIVE,0.5583616495132446
2843,cyclone,melbourne,may ask cyclonesama read jailed fate rindou,0,NEGATIVE,0.9833765625953674
2844,cyclone,vilnius,drugs alcohol jackson roman house,0,NEGATIVE,0.9877445101737976
2846,cyclone,geneva,blending old new prepare future emergencies,0,POSITIVE,0.9661775827407837
2849,cyclone,,wfp wfp delivers food 165000 bangladesh flood victims tropical cyclone komen dhaka ûòthe united na,1,POSITIVE,0.7333187460899353
2851,cyclone,,houses nockthie hamlet taungbazar region buthidaung severely damaged cyclone,1,NEGATIVE,0.9958243370056152
2852,cyclone,made america,cyclone double cherry top outfit,0,POSITIVE,0.9017199873924255
2853,damage,ps4 now asking,theyll allow ascend damage max values,0,NEGATIVE,0.9425697922706604
2854,damage,,drop down nigga damage,0,NEGATIVE,0.9988532066345215
2855,damage,cheshire london,unions say supportive london prepared damage economically å£300m last time,0,NEGATIVE,0.9951025247573853
2856,damage,texas usa,liked video ga 5 online collateral damage ga online pa,0,NEGATIVE,0.9890491962432861
2857,damage,bartholomew county indiana,fyi accident property damage3460 limestone lncolyellowstone wayfieldstone dr0805 15 193635,1,NEGATIVE,0.9975925087928772
2858,damage,,knee damage solution,0,NEGATIVE,0.9973655343055725
2860,damage,mind world,here complaining phoenix mode fire emblem turns ray giant will difficulty option take 0 damage,0,NEGATIVE,0.9975817203521729
2861,damage,,wha kids damage,0,NEGATIVE,0.9996084570884705
2863,damage,catskills,cleared accident property damage eb ny 100,1,NEGATIVE,0.99820876121521
2864,damage,,crazy phone can damage person,0,NEGATIVE,0.9996315240859985
2865,damage,columbia sc,pretty windy here damage,0,NEGATIVE,0.9992140531539917
2866,damage,,reusing advanced life equipments transit drumming champaign damage fdbdp,0,NEGATIVE,0.9985830783843994
2867,damage,right here,careful spotting damage time check time giving away baggage loss wy,0,NEGATIVE,0.9903016090393066
2869,damage,texas,storm damage reported west tennessee,1,NEGATIVE,0.9755154848098755
2870,damage,lawrence ks emporia ks,hey love damage 2,1,POSITIVE,0.9936091899871826
2871,damage,,can keep arches 2 pieces now deals 4000 weapon damage 2500,1,NEGATIVE,0.9929816722869873
2872,damage,indonesia,mages fairy tail specialize property damage natsu dragnet,0,NEGATIVE,0.9949892163276672
2873,damage,unknown,yeah being fast extremely high damage want fast im gon na,1,NEGATIVE,0.9856052994728088
2875,damage,unknown,saw fast af great damage upgraded shitton exclusively whole playthrough,0,NEGATIVE,0.9964538812637329
2877,damage,marysville mi,lets say tree falls fence know homeowners insurance may help,0,NEGATIVE,0.9950492978096008
2878,damage,new haven connecticut,tor tor situation only wind damage enhanced wording key limo,1,NEGATIVE,0.9942306280136108
2879,damage,,happening hear runway lighting damage contractor,1,NEGATIVE,0.9988566637039185
2880,damage,austin san diego,dna written damage ability offer services future prolly dont want work anyway,0,NEGATIVE,0.9600491523742676
2881,damage,,trillion crosses line 3rd time fieldwide attack instant kill damage,1,NEGATIVE,0.9903045296669006
2882,damage,pontevedra galicia,metallic damage,0,NEGATIVE,0.9997003078460693
2883,damage,canada,inmates charged causing damage calvary remand centre riot,1,NEGATIVE,0.996227502822876
2884,damage,londonnew york,crosssectarian protest powerful shia cleric says militias withdrawur fightin isis wont forget damage uve ur ppl,1,POSITIVE,0.8932906985282898
2885,damage,261 5th avenue new york ny,homeowners insurance cover water damage here know,1,NEGATIVE,0.9932560920715332
2886,damage,,beach damage shit,1,NEGATIVE,0.9991937279701233
2887,damage,,crosses arms cover hands anymore damage hello,0,NEGATIVE,0.9789613485336304
2888,damage,,new post blog thesensualeye model cam damage toronto apr 14,0,NEGATIVE,0.9869421720504761
2889,damage,charlotte nc,reported hit amp runin roadwayproperty damage 15901 statesville rd,1,NEGATIVE,0.9982174038887024
2890,damage,,devil may cry 4 special edition vergil agnus window mission 6 dmd damage leedstraif,0,NEGATIVE,0.9938480257987976
2891,damage,rockville maryland,occurs fluid builds pressure inside level may damage optic nerve,1,NEGATIVE,0.9953195452690125
2893,damage,,storm damage reported madison county thunderstorm damage reports ar,1,NEGATIVE,0.9848651885986328
2895,damage,,s61231a puncture wound foreign body left index finger damage nail initial encounter,1,NEGATIVE,0.9877205491065979
2896,damage,australia,thank words warning,0,POSITIVE,0.9612951874732971
2898,damage,conversation,real shit will damage bitch,0,NEGATIVE,0.9994785189628601
2899,damage,usaov,lao fuckyou changed damage control,0,NEGATIVE,0.9950461387634277
2900,damage,bhopal madhya pradesh india,standard damage control,1,NEGATIVE,0.9943870306015015
2902,damage,tennessee,superficial wounds pepper spray damage,1,NEGATIVE,0.9992855191230774
2905,danger,,dad wont chase constantly amp time frequently great deal danger distraction lto,0,POSITIVE,0.9908657670021057
2907,danger,,believe shirt company now animal danger start seeing changes wildlife,0,POSITIVE,0.9091426134109497
2908,danger,ayr,danger union bears,0,NEGATIVE,0.9409539103507996
2909,danger,,sign open falling danger release day blast review tour sign here,1,NEGATIVE,0.9690679907798767
2910,danger,worldwide,check preview danger zone coming soon,0,NEGATIVE,0.8541697263717651
2911,danger,san jose california,red flag warning fire danger amp dry thunderstorms bay area,1,NEGATIVE,0.9493089318275452
2912,danger,worldwide,check preview danger zone coming soon,0,NEGATIVE,0.8541697263717651
2913,danger,loughborough england,like danger,1,NEGATIVE,0.9921234250068665
2915,danger,killarney,last tree cut down last fish eaten last stream poisoned will realize,0,NEGATIVE,0.9830420017242432
2916,danger,brooklyn ny,take away preservation parks imposition amp danger african people imagined,0,NEGATIVE,0.841422438621521
2917,danger,lahar gwalior,indian govt amp media take concern safety danger now,1,NEGATIVE,0.9435142874717712
2920,danger,st paul mn,training grains wheat bare gold august heat anger im trespass seek danger,0,NEGATIVE,0.9872201681137085
2921,danger,atlanta georgia,oppressions greatest danger coming soon album,0,NEGATIVE,0.9582860469818115
2922,danger,,lost moral relevance means whole population danger,0,NEGATIVE,0.9997387528419495
2924,danger,lincoln il,dont like head first slides especially home,0,NEGATIVE,0.8566015362739563
2925,danger,world,permits bear hunting danger outnumbering actual bears licenses florida fir petersburg,0,NEGATIVE,0.690109133720398
2927,danger,spinning time,danger,0,NEGATIVE,0.9980695843696594
2929,danger,atlanta georgia,oppressions greatest danger coming soon album,1,NEGATIVE,0.9582860469818115
2931,danger,boston ma,looking repair recent bad rap partnerships,0,NEGATIVE,0.9989594221115112
2932,danger,hailing dayton,wish victorian secret front im,0,NEGATIVE,0.7440106272697449
2933,danger,worldwide,check preview danger zone coming soon,0,NEGATIVE,0.8541697263717651
2934,danger,newcastle tyne england,arsenal fans want west ham will delegation battle season danger sun,0,POSITIVE,0.7976174354553223
2935,danger,atlanta georgia,oppressions greatest danger coming soon album,0,NEGATIVE,0.9582860469818115
2936,danger,atlanta georgia,oppressions greatest danger coming soon album,0,NEGATIVE,0.9582860469818115
2937,danger,,danger excitement underwater cave diving,0,POSITIVE,0.9815257787704468
2939,danger,,girl wan na save like danger health try being wan na,0,NEGATIVE,0.9930639863014221
2941,danger,instagram trillrebel,guns protection shit shouldn't life danger,0,NEGATIVE,0.9987800717353821
2942,danger,dying resting,thirsty yall danger dehydration,1,NEGATIVE,0.9942240118980408
2943,danger,san jose ca,thunderstorms little rain expected central california high fire danger,1,POSITIVE,0.6828214526176453
2944,danger,05,wan na danger days tattoo bad cool spider look like someones wrist smith,0,NEGATIVE,0.9974871873855591
2945,danger,israel,experience your angry critical pundit grave danger going rails 1,0,NEGATIVE,0.9933226704597473
2946,danger,uruguay westeros gallifrey,am danger skyler am danger,0,NEGATIVE,0.9860326647758484
2947,danger,kansas city mo,dangerous ok rest danger,0,NEGATIVE,0.9905845522880554
2948,danger,silver spring md,investigate robert mueller didn't respond complaints not 11 amp just left meson danger,0,NEGATIVE,0.9939939379692078
2950,danger,jersey ci,honestly tho modify manga stealing living fuck im past best still danger fucktards,1,NEGATIVE,0.9869622588157654
2952,danger,,fear way making see danger contemplating logic situation find courage engage,0,POSITIVE,0.998157799243927
2953,dead,,joel 228 book acts 217,0,NEGATIVE,0.572685182094574
2954,dead,afghanistan,17 dead afghanistan aircraft crashes afghan military helicopter crashed remote region,1,NEGATIVE,0.9875361323356628
2955,dead,sweden,awesome norse landscapes loads atmosphere life boringdead snotgreen wastelands,0,NEGATIVE,0.9795135855674744
2956,dead,,miss longer haircut dead anyways want hair,0,NEGATIVE,0.9970963001251221
2957,dead,,4sake argsuppose preborn attained individl rightsgenerally courtof law forbids killing dead person,0,NEGATIVE,0.9690452218055725
2959,dead,london,remember time boku gave life dead bird hell boku,0,NEGATIVE,0.9562278389930725
2960,dead,orlando fl,nana bee dead like legit zombie feel sore part body,0,NEGATIVE,0.9997205138206482
2963,dead,,just happened road right buses im dead,0,NEGATIVE,0.9992826581001282
2965,dead,atmosphere,lao fucking luis hahaha im dead,0,NEGATIVE,0.9992727637290955
2969,dead,,just watched emmerdale nd dont know who slightly attractive man named ross just beat nd now hes dead,1,NEGATIVE,0.9976218342781067
2970,dead,glasgow,need confirm ross dead cause dont trust oh,0,NEGATIVE,0.9993103742599487
2971,dead,,telltales walking dead characters ampstory real gameplay performance issues,0,NEGATIVE,0.9917377829551697
2973,dead,,beforeitsnews hundreds feared dead libyan migrant boat capsizes rescue û,1,NEGATIVE,0.9811290502548218
2974,dead,portugal,itûªs war came see will see waved white flag front canûªt end dead wont misled,0,NEGATIVE,0.9911323189735413
2975,dead,south stand,fuck sake dead,0,NEGATIVE,0.9957960844039917
2976,dead,dundalk ireland,ross dead,0,NEGATIVE,0.9995095729827881
2980,dead,,don avoid wearing dead black flaming red stark white esp debate blue gold brown shoes,0,NEGATIVE,0.8843863606452942
2982,dead,,perspectives grateful dead critical writings contributions study,1,POSITIVE,0.9997187256813049
2983,dead,sochi kda ru,hello im looking mod cold ice saw site link download dead maybe share thanks,0,NEGATIVE,0.9873231053352356
2984,dead,ìït 2669580727837865,lmaovv hard ny new trend babalmaowelcome nyozi kwaaaaa,0,NEGATIVE,0.9965689182281494
2987,dead,south stand,now ive hes dead dies,0,NEGATIVE,0.9993000030517578
2988,dead,youre 19,ross dead noooooooooooo,0,NEGATIVE,0.9988389611244202
2990,dead,kettering,thinking time friend bailed nite b4 dead showwent alone amp great time alone free dance front row,0,NEGATIVE,0.9819068312644958
2991,dead,united states,typhoon soudelor taking dead aim taiwan,1,NEGATIVE,0.9909049868583679
2992,dead,,emotional ross dead 5,0,NEGATIVE,0.9993707537651062
2993,dead,planet earth,man found dead demi moors swimming pool,1,NEGATIVE,0.9807813167572021
2995,dead,spare oom,thats val dead im suing,1,NEGATIVE,0.9986308217048645
2998,dead,,dead,0,NEGATIVE,0.9995059967041016
3000,dead,united states,wormwood road dead 14 fucking awesome awesome ending awesome,0,POSITIVE,0.9998406171798706
3001,dead,milton keynes,believe ross dead,0,NEGATIVE,0.9968094229698181
3003,death,,will only call text 2 niggas off amp boyfriend love boys death niggas can hold attention like,0,NEGATIVE,0.927033543586731
3004,death,atlal,hate talking otp grandma mean love death talk damn ssshhheeesshh,0,NEGATIVE,0.9975923895835876
3005,death,uptown,death ill rep jets,1,NEGATIVE,0.9993244409561157
3006,death,,vibrator shaped vape busted,0,NEGATIVE,0.9976015686988831
3009,death,prov,death threats nigga life well gon see,0,POSITIVE,0.983619749546051
3010,death,novi mi,adult dies plague colorado,1,NEGATIVE,0.9981337189674377
3011,death,new york,xbox 360 console red ring death full read ebay,0,NEGATIVE,0.9996533393859863
3012,death,buenos aires argentina,going back gainesville will death,1,NEGATIVE,0.9993988275527954
3013,death,,year later ferguson sees change asks itûªs real,0,POSITIVE,0.7742952108383179
3014,death,,enjoy obama era civility prez says got supports iranian death,0,POSITIVE,0.8949037194252014
3015,death,,feel like death,0,NEGATIVE,0.9997696280479431
3016,death,uk,liked video do hazard death sport,0,POSITIVE,0.9140379428863525
3018,death,,tell cousins dont wan na hang text saying coming honestly death wish,0,NEGATIVE,0.9439897537231445
3019,death,,ass judge orders texas recognize spouse siamese death certificate,0,NEGATIVE,0.9394718408584595
3021,death,mpls,loyalty mission involves kicking shitty nobleman death love elven weirdo,0,NEGATIVE,0.975616455078125
3022,death,kensington md,way seeketh right man end thereof ways death,1,NEGATIVE,0.9983623623847961
3023,death,buffalodc,thanks narrowly averted death fun your right,1,POSITIVE,0.9920594692230225
3025,death,,katherine death,0,NEGATIVE,0.9991158843040466
3026,death,sylacauga alabama,death muslims,1,NEGATIVE,0.9993823766708374
3027,death,,going starve death,0,NEGATIVE,0.998939573764801
3029,death,,ted cruz bashes obama comparison got iranians shouting death america,0,NEGATIVE,0.9957914352416992
3030,death,,katherine death,0,NEGATIVE,0.9991158843040466
3034,death,,new crime knowing rights punishable death,0,NEGATIVE,0.9836791157722473
3036,death,usa,issues uploading death smoochy awakenings clips reason bicentennial man being pain ass,0,NEGATIVE,0.9941241145133972
3037,death,right,ted cruz bashes obama comparison got iranians shouting death america,1,NEGATIVE,0.9957914352416992
3038,death,cyprus,news analysis mullah mars death may split taliban ranks mars demise certainly lead,1,NEGATIVE,0.9849600195884705
3039,death,kansas,feel like deathly moles,0,NEGATIVE,0.9997732043266296
3042,death,los angelesca usa,video slain mexican journalist unknowingly predicted death,0,NEGATIVE,0.9958128333091736
3043,death,portland,old lady rockin death metal sedan downtown smoking cigarette found real mom,0,NEGATIVE,0.9804774522781372
3044,death,carry jutta,afghan peace talks doubt mullah mars death financial times,0,NEGATIVE,0.8912415504455566
3045,death,home takers,yall pusssssssssy shoook death,0,NEGATIVE,0.9996281862258911
3047,death,new york new york,first trial death just postponed,0,NEGATIVE,0.997052788734436
3048,death,,53 years ago week anniversary marilyn monroes death ripriprip,0,NEGATIVE,0.9626988172531128
3049,death,sss,arms hints snippets will death,0,NEGATIVE,0.9989262223243713
3051,death,chicago,tomorrow will death,0,NEGATIVE,0.9995338916778564
3052,death,alicante spain,new ny legionnaires disease death toll rises,1,NEGATIVE,0.9763521552085876
3053,deaths,,2 deaths measles complications 10 yrs looses shit 8 dead legionnaires month amp crickets,1,NEGATIVE,0.996819257736206
3054,deaths,,bigamist û÷firstûª wife charged deaths û÷secondûª pregnant wife child 8 mother nephew 1 uû,0,NEGATIVE,0.9906612038612366
3055,deaths,mooresville nc,dont i south huge wreck airlift maybe deaths interstate completely blocked,1,NEGATIVE,0.9993634819984436
3056,deaths,mooseknuckle maine,ûï 22 cases voter fraud year need new laws 83 gun deaths day who actually follows laws amirite,1,NEGATIVE,0.9786645770072937
3057,deaths,palermo sicily,silence,1,NEGATIVE,0.9986234903335571
3058,deaths,,bef jeans died fedayeen aks bloody ideas rifles blame soldiers deaths mod,1,NEGATIVE,0.9978715181350708
3059,deaths,asunciìnpy tìbingenger,breast milk original rates worldwide stalled 40 contributing 800000 child deaths last year,0,NEGATIVE,0.9932333827018738
3060,deaths,voorhees nj,12 deaths relight running crashes pedestrians cyclists amp vehicle occupants hit relight runners,1,NEGATIVE,0.9989182949066162
3061,deaths,,rt 250k deaths year error avoid being,1,NEGATIVE,0.9948569536209106
3062,deaths,,2 deaths measles complications 10 yrs looses shit 8 dead legionnaires month amp crickets,1,NEGATIVE,0.996819257736206
3064,deaths,,bigamist first wife charged deaths second pregnant wife child 8,0,NEGATIVE,0.9893407225608826
3066,deaths,uk,500 deaths year foodborne illness dears,1,NEGATIVE,0.9696864485740662
3068,deaths,atlanta ga,hear talk avoid thousands resistant infectionsdeaths next 5 yrs,0,NEGATIVE,0.9838207960128784
3070,deaths,planet earth,irony just died thousand deaths,0,NEGATIVE,0.997326135635376
3071,deaths,wakanda,lol im being objective here maybe uncle ben course deaths end business usual,0,NEGATIVE,0.9979326725006104
3072,deaths,lagos,comment deaths older children data tell,1,NEGATIVE,0.9927672147750854
3073,deaths,matter,deaths 7,1,NEGATIVE,0.9961931705474854
3074,deaths,,will know happened govt think beliefs warranted deaths innocent japs,1,NEGATIVE,0.992230236530304
3075,deaths,screen,real magic real life women went missing ohio town focus fbi probe strange deaths,1,POSITIVE,0.9975874423980713
3077,deaths,phoenix az,cases dont constitute epidemic,1,POSITIVE,0.6976599097251892
3079,deaths,matter,deaths 3,0,NEGATIVE,0.9973840117454529
3080,deaths,edinburgh,lunch stewart amp julian only couple hours earlier finally find happened,0,POSITIVE,0.6350148320198059
3082,deaths,weyburn,hepburn police warn public fentanyl deaths province,1,NEGATIVE,0.9918898940086365
3083,deaths,uga 15 alumnus economics,annoying crusty lives matter head ass people actually support causes just hate black deaths attention,0,NEGATIVE,0.9994850158691406
3084,deaths,,time reduce gun deaths,1,NEGATIVE,0.991351842880249
3085,deaths,,amp stat high auto deaths applies children vehicle guess can run hightail adult,0,NEGATIVE,0.9962418079376221
3086,deaths,blackpool,cancers equate 25 deaths knowing signs save life,1,NEGATIVE,0.9947117567062378
3089,deaths,void usa,reverse situation lol dont know 911 civilian deaths specifically utilized political,1,NEGATIVE,0.9969738721847534
3090,deaths,london town,heard theres deaths murder christie kills adam val finn die,0,NEGATIVE,0.9956284761428833
3091,deaths,tennesseegallifrey,died horrible deaths trapped ships knew risk,1,NEGATIVE,0.9979027509689331
3092,deaths,amman jordan,fo minister condemns attack mosque saudi arabia resulted least 15 deaths,1,NEGATIVE,0.9917102456092834
3093,deaths,blackpool,cancers equate 25 deaths knowing signs save life,1,NEGATIVE,0.9947117567062378
3095,deaths,washington dc,critters climate plague deaths colorado,1,NEGATIVE,0.9994040727615356
3097,deaths,,1940 year angela sanders born roundhouse kick deaths increased 13000 percent,1,NEGATIVE,0.8827089071273804
3099,deaths,columbia heights mn,palmar taking steps keep children safe hot vehicles take look innovative car seat here,0,POSITIVE,0.9966849684715271
3100,deaths,top secret,10 17 beluga deaths reported average age 15 12 years,1,NEGATIVE,0.9910706281661987
3101,deaths,ìït 1061481786848072612195582811791382,bigamist first wife charged deaths second pregnant wife child 8 mother,1,NEGATIVE,0.9895929098129272
3102,deaths,top secret bunker,plus reduce cyclist deaths compulsory highway code test vehicle uses road,1,NEGATIVE,0.9379235506057739
3104,debris,belbroughton england,plane debris missing mh370 part aircraft wing found reunion island th,1,NEGATIVE,0.9985823631286621
3105,debris,,malaysia airlines flight 370 disappeared months ago debris found south indian ocean,1,NEGATIVE,0.9961804151535034
3106,debris,,mh370 aircraft debris found la reunion missing malaysia airlines,1,NEGATIVE,0.9992375373840332
3107,debris,772 temperance permenence,discovered plane debris missing malaysia airlines flight 370 time,1,NEGATIVE,0.9986847043037415
3108,debris,,confirmed debris mh370,1,NEGATIVE,0.9207251667976379
3109,debris,,mh370 aircraft debris found la reunion missing malaysia airlines,1,NEGATIVE,0.9992375373840332
3111,debris,nigeria,malaysia confirms plane debris washed reunion island flight mh370,1,NEGATIVE,0.9956651329994202
3112,debris,,mh370 aircraft debris found la reunion missing malaysia airlines,1,NEGATIVE,0.9992375373840332
3114,debris,469501097439469,missing jetûªs debris floated rì©union new york times,1,NEGATIVE,0.998795747756958
3115,debris,,reunion debris surely flight 370 officials say new york times,1,NEGATIVE,0.9959284663200378
3116,debris,,reunion debris surely flight 370 officials say new york times,1,NEGATIVE,0.9959284663200378
3117,debris,shadows,debris found reunion island flight mystery plane disappearance novel,1,NEGATIVE,0.9872866272926331
3118,debris,,mh370 aircraft debris found la reunion missing malaysia airlines,1,NEGATIVE,0.9992375373840332
3119,debris,campo grandems,reuters debris confirmed mh370 relatives hope discovery crash site,1,NEGATIVE,0.9877304434776306
3120,debris,nbc washington,nbcnightlynews malaysian officials say debris found reunion island billneelynbc reports,1,NEGATIVE,0.9959716200828552
3122,debris,,mh370 debris found reunion island,1,NEGATIVE,0.9613384008407593
3123,debris,seattle,malaysian prime minister naib raza confirmed aircraft debris found reunion isla,1,NEGATIVE,0.7449703812599182
3124,debris,hamilton ontario canada,malaysia france plane debris missing mh370,1,NEGATIVE,0.9992302656173706
3125,debris,new york,malaysian officials say debris found reunion island reports,1,NEGATIVE,0.9741367101669312
3126,debris,,mh370 aircraft debris found la reunion missing malaysia airlines,1,NEGATIVE,0.9992375373840332
3130,debris,,debris found reunion island comes mh370 malaysian pm,1,NEGATIVE,0.9831098318099976
3131,debris,,aircraft debris found island mh370 malaysia confirms,1,NEGATIVE,0.8639401793479919
3132,debris,dubai united arab emirates,irony debris flight mh370 found reunion island,1,NEGATIVE,0.7444026470184326
3133,debris,india,mh370 aircraft debris found la reunion missing malaysia airlines abc online,1,NEGATIVE,0.9989055395126343
3134,debris,hong kong,mh370 reunion debris missing malaysia flight,1,NEGATIVE,0.9986598491668701
3136,debris,berlin germany,experts leave lab malaysia confirms debris,1,NEGATIVE,0.9929048418998718
3137,debris,nigeria,malaysia confirms plane debris washed reunion island flight mh370,1,NEGATIVE,0.9956651329994202
3138,debris,iraq,debris confirmed mh370 relatives hope discovery crash,1,NEGATIVE,0.9954492449760437
