id,keyword,location,text,target,sentiment,score
5458,first responders,sacramento ca,firefighters gains jerry brown heading area meet first responders tomorrow morning,1,POSITIVE,0.9351223111152649
5459,first responders,franklin tn near nashville,shooting event theater giving free coffee first responders police amp firefighters antiochhickoryhollow,1,NEGATIVE,0.9526942372322083
5460,first responders,st louis missouri,lender fees veterans first responders past present,0,NEGATIVE,0.8741909861564636
5461,flames,bandung,new giant flames giant full black pantofel infoorder sms087809233445 pin23928835 pictwittercompnpizody,1,NEGATIVE,0.9886642098426819
5462,flames,new york,new snap tools black baseball hatcap silvergray embroidered logo flames full reû,0,NEGATIVE,0.9446466565132141
5465,flames,new york,new snap tools black baseball hatcap silvergray embroidered logo flames full reû,0,NEGATIVE,0.9446466565132141
5466,flames,louisville ky,vampire going table flames,0,POSITIVE,0.5789258480072021
5467,flames,,cabin fever 2 flames,0,POSITIVE,0.9742540717124939
5468,flames,manhattan ny,summon flames directly hell store bought fine mommies,0,NEGATIVE,0.8509875535964966
5469,flames,freeport ny,just added fire flames saturday rick wonder will spinning guest set chichi,0,POSITIVE,0.998247504234314
5471,flames,650559,yoga flames,0,POSITIVE,0.9887819886207581
5473,flames,,makes penalty killer,0,POSITIVE,0.672554075717926
5475,flames,dreamy lake,guess can say is hopes went flames,0,NEGATIVE,0.9871557950973511
5476,flames,,ill cry pity partys flames,0,NEGATIVE,0.9950138926506042
5477,flames,houstn,new lil chance flames,0,POSITIVE,0.9954478144645691
5479,flames,hell,wish add flames nails im fire,1,POSITIVE,0.9921343326568604
5480,flames,asheville nc,gang walking round brown flames amp thats 100nd,0,NEGATIVE,0.9929169416427612
5481,flames,new york,new snap tools black baseball hatcap silvergray embroidered logo flames full reû,0,NEGATIVE,0.9446466565132141
5482,flames,st patricks purgatory,dude just smoking fucking went flames bomb went om scared,1,NEGATIVE,0.9974107146263123
5484,flames,,maryland mansion fire killed 6 caused damaged plug christmas tree report says flames,1,NEGATIVE,0.9938282370567322
5485,flames,,new giant flames giant manly brown infoorder sms087809233445 pin2327564d,0,NEGATIVE,0.9185898900032043
5486,flames,united states,ûïyou see devastation amp itûªs shockingûï firefighters continue battle flames california benstracy reports û,1,NEGATIVE,0.9954755902290344
5487,flames,manaus,watching flames,1,POSITIVE,0.9972831010818481
5488,flames,sioux falls sd,rp can see smoke coming silo 260th street hartford flames,1,NEGATIVE,0.6965003609657288
5489,flames,,chose can search joy just weûªll near smiles matter cold flames burn bod,0,NEGATIVE,0.6387871503829956
5491,flames,republica dominicana,maryland mansion fire killed 6 caused damaged plug christmas tree report says flames firefighters bravery,1,POSITIVE,0.9624279737472534
5492,flames,eastlake,setting flames,0,POSITIVE,0.9991868138313293
5493,flames,hillsvillelynchburg va,thats optimistic side doubt tough can feel like games will pivot defense,0,NEGATIVE,0.8900272846221924
5494,flames,usa,maryland mansion fire killed 6 caused damaged plug christmas tree report says flames,1,NEGATIVE,0.9938282370567322
5495,flames,,pardon burst flames ive world peoples mindless games,0,NEGATIVE,0.987220823764801
5496,flames,travelling world,want burst flames anna hugged tightly,0,POSITIVE,0.9973182082176208
5497,flames,616 û¢ kentwood mi,elmo catching flames im just gon na witnessing slaughter,1,POSITIVE,0.9438523054122925
5498,flames,,bloody ell let burn,0,NEGATIVE,0.9986666440963745
5499,flames,,opinion dont put the internet will first flames,0,NEGATIVE,0.9708312153816223
5501,flames,jet life,rising follower graph 2 followers past week stats right here,0,NEGATIVE,0.8197124004364014
5502,flames,fairy tail,just gray ophelia red flames blazing person setting nearly area,1,POSITIVE,0.974680483341217
5503,flames,santo domingo alma rosa,soloquiero maryland mansion fire killed 6 caused damaged plug christmas tree report says flames firefighte,1,NEGATIVE,0.9919266700744629
5505,flames,,maryland mansion fire killed 6 caused damaged plug christmas tree report says flames,1,NEGATIVE,0.9938282370567322
5506,flames,houston corsicana,shots tomorrow cause im recording flames will thrown tomorrow,0,NEGATIVE,0.93161541223526
5507,flames,cincinnati,added video playlist nicki mina flames official video,0,POSITIVE,0.9900720119476318
5509,flames,bacon,sean bro can admit sean flames now sean,0,POSITIVE,0.9105676412582397
5510,flames,,advantages apropos flames favorable regard mississauga ontario pwhvgwax,0,POSITIVE,0.9851166605949402
5514,flattened,mansion,flattened cartoonylike whoa papa,0,NEGATIVE,0.9931873083114624
5515,flattened,chicago,road success paved pennies flattened train tracks your welcome,0,POSITIVE,0.9967621564865112
5517,flattened,astley manchester,feel like ive flattened sumo wrestler pain gain,0,NEGATIVE,0.9971519708633423
5518,flattened,bow nh,ideas food flattened,0,NEGATIVE,0.9992187023162842
5519,flattened,leicester,coma just flattened,0,NEGATIVE,0.9996849298477173
5520,flattened,frome somerset england,coma just absolutely flattened guy,0,NEGATIVE,0.9995911717414856
5521,flattened,mars,flattened,0,NEGATIVE,0.9996664524078369
5522,flattened,melbourne victoria,70 years ago first atomic attack flattened 3 days later war crimes put moscow place,1,NEGATIVE,0.9716520309448242
5524,flattened,uk,today august 6th 70th anniversary abomb little boy dropped hiroshima70000 killed outright city flattened,1,NEGATIVE,0.9826280474662781
5525,flattened,essex england,just flattened little midget,0,NEGATIVE,0.9958987832069397
5526,flattened,new york ny,who yosemite sam drumpf ûïnobody û÷ill vote flattened rabbit skin ahuh û sayû,0,NEGATIVE,0.9969149827957153
5528,flattened,cold,flattened machidadid lose fightnope lost fights guys shouldnt lost,1,NEGATIVE,0.9882696866989136
5529,flattened,barbados,early birds de cups lag bout pun de dock watch pal drink,0,NEGATIVE,0.9947369694709778
5531,flattened,,contain being flattened shuffled feet kick slide didn't hands chest,0,NEGATIVE,0.966507077217102
5532,flattened,leeds,flattened striker,1,NEGATIVE,0.9978078007698059
5534,flattened,wahpeton nd,picking flattened hay men masonite wahpeton nd,0,NEGATIVE,0.9986209869384766
5535,flattened,,coma just flattened guy,0,NEGATIVE,0.9997149109840393
5538,flattened,chorley lancashire uk,fylde building set flattened prestonûªs city centre iconic buildings disappearing skyline,0,NEGATIVE,0.9957084655761719
5539,flattened,,hide kids hide wife hes loose thought flattened ball,0,NEGATIVE,0.9980701804161072
5540,flattened,,wouldve great biwa just flattened little rat,0,NEGATIVE,0.9991511106491089
5541,flattened,northampton ma,puckflattened ball lol,0,NEGATIVE,0.9902100563049316
5544,flattened,ventura,dont doubt implicit statement makes want flattened bus,0,NEGATIVE,0.9927358627319336
5545,flattened,le memenet,flattened mayor mayor balding imperfect biker marine emo generic western hero,0,NEGATIVE,0.9991651773452759
5547,flattened,lubbock texas,think risk losing nose flattened,0,NEGATIVE,0.9958011507987976
5548,flattened,derby,mums literally just picked new car today flattened battery trying sort bluetooth,0,NEGATIVE,0.9994876384735107
5552,flattened,mississauga ontario,motley flattened harper heartland harper imported tens thousands tow slaves cost algerians jobs,0,NEGATIVE,0.9919465184211731
5553,flattened,delhi,flattened frog,0,NEGATIVE,0.9984601736068726
5554,flattened,keighley england,imagine flattened kurt coma,0,NEGATIVE,0.9953997731208801
5555,flattened,pomfretprovidence,fallacy steam roller object will flattened,0,NEGATIVE,0.9992929697036743
5556,flattened,baltimore md,photo beach earrings beach jewelry vacation earrings keep calm beach earrings made flattened,0,NEGATIVE,0.7619162201881409
5557,flattened,,100 1 mix new flat double sided lifeless bottle caps choose mix flattened full real,0,NEGATIVE,0.9989218711853027
5558,flattened,east lansing mi,flat footballs like flattened spartans crushing back day,0,NEGATIVE,0.9996393918991089
5559,flattened,rocketing galaxy,seen far dreamy look came face ears flattened started walk slowly youd,1,NEGATIVE,0.9860994219779968
5560,flattened,new york,100 1 mix new flat double sided lifeless bottle caps choose mix flattened full real,0,NEGATIVE,0.9989218711853027
5561,flood,boston,fizzy sitting regular flood seats knows who,0,NEGATIVE,0.950982391834259
5563,flood,united states,jal cancels flash flood warning bell harlan knox my,1,NEGATIVE,0.9981936812400818
5564,flood,new york,spot flood combo 53inch 300w curved cree led work light bar 4x4 offroad fog lamp full reû,1,NEGATIVE,0.9856498837471008
5565,flood,new york,spot flood combo 53inch 300w curved cree led work light bar 4x4 offroad fog lamp full reû,0,NEGATIVE,0.9856498837471008
5567,flood,warrandyte australia,small flood bigåêconsequences,1,NEGATIVE,0.5587424635887146
5569,flood,british columbia canada,homecoming queen killed way home prom flood waters,1,NEGATIVE,0.9956644177436829
5570,flood,,ups how cree led work light offload lamp car truck boat mining and flood beam full real,0,POSITIVE,0.993922770023346
5573,flood,,raining left now im drowning flood see ive fighter give,0,NEGATIVE,0.9147199988365173
5575,flood,aixenprovenceutrecht,still fish die worldwide flood wonder,0,POSITIVE,0.986221969127655
5576,flood,philadelphia,dont flood poor mentions hes put work,1,NEGATIVE,0.9758383631706238
5577,flood,new york,spot flood combo 53inch 300w curved cree led work light bar 4x4 offroad fog lamp full reû,0,NEGATIVE,0.9856498837471008
5578,flood,van buren mo,didn't,0,NEGATIVE,0.9721068143844604
5579,flood,new york,12 how cree led work light bar alloy spot flood combo diving offload and boat full ready,0,NEGATIVE,0.9275960326194763
5580,flood,new york,ups how cree led work light offload lamp car truck boat mining and flood beam full real,1,POSITIVE,0.993922770023346
5581,flood,niagara falls ontario,cue flood people ironically calling,0,NEGATIVE,0.9223427772521973
5582,flood,usa,motors hot deals get six how rev rev led work light flood lamp tractor truck suv utv a,0,NEGATIVE,0.989234983921051
5584,flood,,85v265v 10w led warm white light motion sensor outdoor flood light pir lamp auc,0,NEGATIVE,0.5695078372955322
5586,flood,hawaii usa,iembothfo 1000 am 2 nnw hana maui hi county official reports coastal flood,1,NEGATIVE,0.8984377384185791
5587,flood,new york,1 pair new how 4 round led work driving flood light offload atv utv full read ebay,0,NEGATIVE,0.9962701797485352
5588,flood,new york,ups how cree led work light offload lamp car truck boat mining and flood beam full real,0,POSITIVE,0.993922770023346
5589,flood,,internet basics flood defective intertissue soul mate milk trench host guabxfv,1,NEGATIVE,0.9988652467727661
5590,flood,,box issues areal flood advisory shelby al bug 5 900 am cut,1,NEGATIVE,0.9957736134529114
5592,flood,new york,ups how cree led work light offload lamp car truck boat mining and flood beam full real,0,POSITIVE,0.993922770023346
5593,flood,usa,flood advisory effect shelby county al 9 am,1,POSITIVE,0.7733157873153687
5594,flood,united states,rt grantfactory weymouth meeting seawalls flood grants set thursday night û,1,NEGATIVE,0.7336326241493225
5595,flood,new york,spot flood combo 53inch 300w curved cree led work light bar 4x4 offroad fog lamp full reû,0,NEGATIVE,0.9856498837471008
5598,flood,new york,spot flood combo 53inch 300w curved cree led work light bar 4x4 offroad fog lamp full reû,0,NEGATIVE,0.9856498837471008
5599,flood,new york,spot flood combo 53inch 300w curved cree led work light bar 4x4 offroad fog lamp full reû,0,NEGATIVE,0.9856498837471008
5600,flood,united states,flood advisory issued august 05 428pm edt nws,1,NEGATIVE,0.6036961674690247
5602,flood,,survived plague floated flood just peeked heads mud ones immune deafening bells god will survive,0,NEGATIVE,0.9878897070884705
5603,flood,new york,spot flood combo 53inch 300w curved cree led work light bar 4x4 offroad fog lamp full reû,0,NEGATIVE,0.9856498837471008
5604,flood,usa,flood prone waterways westchester county now eligible millions state,1,POSITIVE,0.9360451102256775
5605,flood,waddesdon,chinese rescue team arrives myanmar help flood victims sittway,1,NEGATIVE,0.7564345598220825
5608,flood,knoxville tn,flood advisory issued august 05 710pm cdt august 05 800pm cdt nws urban,1,NEGATIVE,0.8978824615478516
5609,flood,new york,12 how cree led work light bar alloy spot flood combo diving offload and boat full ready,0,NEGATIVE,0.9275960326194763
5611,flooding,rock springs wy,rock springs ûò residents living elk street continue battle flooding issues mondayûªs rain storm whileû,1,NEGATIVE,0.9825477004051208
5612,flooding,vietnam,cuban leader extends sympathy vietnam flooding,1,NEGATIVE,0.9652567505836487
5613,flooding,tampast petersburg fl,business sponge docks washed rain flooding,1,NEGATIVE,0.9788188934326172
5614,flooding,,thrusts little jams cock deep inside flooding womb pussy hot thick,0,POSITIVE,0.9072000980377197
5617,flooding,usa,severe thunderstorms flash flooding possible midsouth midwest,1,NEGATIVE,0.9622067809104919
5618,flooding,huntsville alabama,1130a radar update widespread showersstorms moving areasminor flooding possible,1,NEGATIVE,0.8757094144821167
5619,flooding,nova scotia canada,tips prevent basement leaks create control joints eliminate random cracking,0,POSITIVE,0.9573854804039001
5620,flooding,,flooding,1,NEGATIVE,0.9966121315956116
5621,flooding,metro manila,reported flooding po area ten,0,NEGATIVE,0.9625672698020935
5622,flooding,,flooding kills 166 displace million pakistan daily news amp analysis,1,NEGATIVE,0.9967384934425354
5624,flooding,breaking news,flooding kills 166 displace million pakistan daily news amp analysis,1,NEGATIVE,0.9967384934425354
5625,flooding,jakartakuala lumpurspore,flooding 10 villages underwater world vision responding,1,POSITIVE,0.8144369125366211
5626,flooding,uk,british breakers rescued flash floods himalayan group british to,1,POSITIVE,0.9833444952964783
5627,flooding,,maybe plan dilute can safely say start charging longs come flooding,0,NEGATIVE,0.9978598952293396
5628,flooding,vietnam,cuban leader extends sympathy vietnam flooding,1,NEGATIVE,0.9652567505836487
5629,flooding,,ill only do hotel people flooding notifications asking,0,NEGATIVE,0.9976790547370911
5631,flooding,accept song requests,waves flooding shore find way home anymore thats look,1,POSITIVE,0.9867204427719116
5632,flooding,honolulu hawaii,flooding occurs home mold growth,1,NEGATIVE,0.9919018149375916
5633,flooding,,flooding tracks caused derailment sa,1,NEGATIVE,0.9983758926391602
5634,flooding,miami beach fl,chinese flooding ny market like,0,NEGATIVE,0.972093939781189
5635,flooding,republic texas,obama keeps 27 iraqi christian asylum seekers ndetention flooding wunscreened muslims,1,NEGATIVE,0.9863325953483582
5638,flooding,california usa,grateful support flooding dinner guests thank,1,POSITIVE,0.9998570680618286
5641,flooding,huntsville al,flash flooding madison,1,NEGATIVE,0.9656175971031189
5642,flooding,,soon start flooding comment section come brazil comments be will,0,NEGATIVE,0.944391131401062
5644,flooding,dont run,last year just drums flooding janice im falling,0,NEGATIVE,0.9980149269104004
5645,flooding,west midlands,ûï burst water causes major flooding birmingham hospital omg,1,NEGATIVE,0.9941273927688599
5646,flooding,jakartakuala lumpurspore,heavy rainfall flooding northern situation report not,1,NEGATIVE,0.9951286315917969
5647,flooding,,god memories flooding back,0,POSITIVE,0.979762613773346
5650,flooding,globalnolocation,burst water pipe floods apartments nycha senior center ny1 ny1burst water pipe floods,1,NEGATIVE,0.9973403811454773
5651,flooding,,let look tom feels flooding back,0,NEGATIVE,0.9818165302276611
5652,flooding,jakartakuala lumpurspore,mandar of assisting thousands worst flooding decades hits parts mandar,1,POSITIVE,0.6573607921600342
5653,flooding,ocean city nj,residents central part ocean city heard engineers flood mitigation options tuesday,1,POSITIVE,0.5526910424232483
5654,flooding,,wen finally girl want im flooding yall wit pics is tho,0,NEGATIVE,0.9861621856689453
5655,flooding,belleville,see flooding mad decent,0,POSITIVE,0.9897390007972717
5656,flooding,kualar lumpur malaysia,monsoon flooding kills dozens mandar prompting calls help,1,NEGATIVE,0.9981429576873779
5657,flooding,austin tx,memorial unveiled travis county deputy killed sept flooding travis county sheriff greg hamilton joined,1,POSITIVE,0.9898028373718262
5658,flooding,,flooding kills 166 displace million pakistan least 166 people killed nearly 11 lakhs,1,NEGATIVE,0.9852384924888611
5659,flooding,nadiad gujarat india,thankkk soo flooding notificationsu fella parsholics superb amp jus soo awesomelove love,0,POSITIVE,0.9850848317146301
5661,floods,south dc,slip sliding away flash floods writers tony pester,1,NEGATIVE,0.997035026550293
5662,floods,,who bringing tornadoes floods who bringing climate change god america plaguing,1,NEGATIVE,0.514660120010376
5663,floods,adventist lesson sabbath,mandar flooding heavy monsoon rains month july caused flooding flash floods lands,1,NEGATIVE,0.927528440952301
5664,floods,australia,119000 people taken shelter 966 relief camps government set,1,NEGATIVE,0.9636468887329102
5665,floods,,dont worry im sure climate hail floods tornados alberta amp ontario im sure gods just mad,1,NEGATIVE,0.995719850063324
5668,floods,passamaquoddy,thought wif moment here months 90 degree heat next will flash floods,1,NEGATIVE,0.981160581111908
5669,floods,û¢iiixiimmxiû¢,granted like half town floods rains still,1,NEGATIVE,0.9713485836982727
5670,floods,sherwood brisbane australia,spa site multiple 7 story high rise buildings next low density character residential area floods,0,NEGATIVE,0.979951798915863
5671,floods,canada,hope mountain dew erodes throat floods lungs leaving drown death,1,NEGATIVE,0.9993160963058472
5672,floods,michigan,disaster group stunned floods,1,NEGATIVE,0.9950619339942932
5673,floods,london,theres person amp reckon your dying brain floods dot causing relive life real time simulation,0,NEGATIVE,0.9922572374343872
5674,floods,,remembered old song havent heard years words carry floods memories,0,POSITIVE,0.9953824877738953
5675,floods,california,floods fishing finally sunshine amp fab deals albertsons anniversary sale lauren paints beautiful life,0,POSITIVE,0.9963300824165344
5676,floods,globalnolocation,bengal floods cm mamata banerjee blames dvc bjp claims state failed economic,1,NEGATIVE,0.9990780353546143
5677,floods,,69 dead due floods myanmar naypyidaw aug 5 prensa latina death toll rose today 69 myanmar,1,NEGATIVE,0.9756646752357483
5680,floods,estados unidos,typhoon soudelor approaches 7 killed 2 missing floods philippines,1,NEGATIVE,0.9303930401802063
5683,floods,new jersey,rains no flash floods just desert grief taxes,1,NEGATIVE,0.9853493571281433
5684,floods,new york ny,download itunes floods glory quiz santos,0,NEGATIVE,0.9292412400245667
5685,floods,timaru district new zealand,yep floods 1999 00 clyde dam releasing bit water speccy ev charging way,1,POSITIVE,0.6790136098861694
5686,floods,cameroon,agenda floods kill animals birds,1,NEGATIVE,0.9958609938621521
5687,floods,st austell cornwall,hope rains whole weekend hope floods portals sentient,0,POSITIVE,0.8535542488098145
5688,floods,ogba lagos nigeria,ape chieftain tasks dicks numb floods donation bagels,1,NEGATIVE,0.9969531297683716
5689,floods,philippines,pagasa 712am yellow warning panay island guimaras negros possible floods lowlying areas amp landslides mountainous areas,1,NEGATIVE,0.9856614470481873
5690,floods,,rt 40hourfamine government declared floods emergency will continue mû,1,NEGATIVE,0.9906788468360901
5692,floods,north america,nearly 50 thousand people affected floods,1,NEGATIVE,0.9449673891067505
5693,floods,earth,etp bengal floods cm mamata banerjee blames dvc bjp claims state failed relief funds flood,1,NEGATIVE,0.9981895089149475
5694,floods,,may allah help suffering floods families,1,NEGATIVE,0.5999181270599365
5695,floods,,children mandar face double catastrophe floods hit,1,NEGATIVE,0.9801623821258545
5698,floods,new york usa,love drake floods instagram makes feel real tune like sun,0,POSITIVE,0.9996278285980225
5703,floods,,69 die mandar floods 250000 affected,1,NEGATIVE,0.9864552021026611
5704,floods,,typhoon soudelor approaches 7 killed 2 missing floods philippinesû,1,NEGATIVE,0.9532628059387207
5705,floods,,memphis floods,1,NEGATIVE,0.995573878288269
5706,floods,2146244615802 17,floods cause damage death across asia media content 0508 15,1,NEGATIVE,0.9992374181747437
5707,floods,rio de janeiro,gas soon maintenance ends floods servers servers destroyed extreme load maintenance starts anew,0,NEGATIVE,0.9985795021057129
5711,forest fire,,e112 particulatebreak solid combust fossil fuel voltaic active forest fire biological vocpetroleum ch4 bacteria decomposition,1,NEGATIVE,0.9566348791122437
5712,forest fire,pdx,careful who lives west beaverton forest grove rapidly spreading fire heading east,1,POSITIVE,0.9112081527709961
5713,forest fire,shelby county,added video playlist ori bind forest ep 6 fire death,1,NEGATIVE,0.9873966574668884
5714,forest fire,,careless match can start forest fire takes whole box start campfire,1,NEGATIVE,0.9986396431922913
5715,forest fire,port matilda pa,little forest fire wardens,1,NEGATIVE,0.8852200508117676
5716,forest fire,concord nc,fire pish national forest grows 375 acres,1,POSITIVE,0.9688616991043091
5717,forest fire,redding california usa,ashenforest floorburnt manzanita amp timber johnson fire ridge forest road 1,1,NEGATIVE,0.9971285462379456
5719,forest fire,,runs setting forest fire bites shit neck,1,NEGATIVE,0.9982366561889648
5720,forest fire,,sets forest fire,1,POSITIVE,0.9854382276535034
5721,forest fire,slatinaromania,liked video cole fire squad 14 forest hills drive,0,POSITIVE,0.9832399487495422
5722,forest fire,redding california usa,view smoke column rising south end blake fire forest road 1,1,POSITIVE,0.9788326025009155
5724,forest fire,,starts forest fire can put,1,POSITIVE,0.519441545009613
5726,forest fire,asheville nc,fire pish national forest grows 375 acres,1,POSITIVE,0.9688616991043091
5727,forest fire,,grill school function grills going pretty forest fire between made work,0,NEGATIVE,0.9929637312889099
5729,forest fire,,515p who watch forest fire smoke lifted nuff fme tmake run tthe pet store hwy ill bhome 7p,1,NEGATIVE,0.9933984279632568
5730,forest fire,los angeles now,forest fires here only fire watch,1,NEGATIVE,0.9196037650108337
5732,forest fire,,forest service firefighter david rahl 38 died frog fire modo national forest temporarily reassigned,1,NEGATIVE,0.9870250225067139
5733,forest fire,western washington,uses acronym united states fire service,0,NEGATIVE,0.6509496569633484
5734,forest fire,atlanta,careless match can start forest fire takes whole box start campfire,0,NEGATIVE,0.9986396431922913
5736,forest fires,,only can prevent forest fires,1,NEGATIVE,0.9495468139648438
5739,forest fires,,california fires rage forest service sounds alarm rising wildfire costs i,1,NEGATIVE,0.9914813041687012
5740,forest fires,,ducks big flat feet stamp forest fires elephants big flat feet stamp flaming ducks,0,NEGATIVE,0.97421795129776
5741,forest fires,alberta canada,wow rest summer worry forest fires calvary 8 hours away,1,NEGATIVE,0.8628169894218445
5743,forest fires,washington dc,california fires rage forest service sounds alarm sharply rising wildfire costs,1,NEGATIVE,0.924466609954834
5744,forest fires,,little concerned number forest fires ill living,1,NEGATIVE,0.998273491859436
5745,forest fires,,trump climate denier algae bloom pacific calf alaska seaweed caribbean forest fires snowball income,1,POSITIVE,0.8571034073829651
5746,forest fires,montana,forest service now spends gt50 budget fighting fires,1,NEGATIVE,0.9968355298042297
5748,forest fires,,cartoon bears have knowledge forest fires toilet paper,0,NEGATIVE,0.9863284230232239
5751,forest fires,,first year forest service spent half annual budget fighting fires,1,NEGATIVE,0.9926251769065857
5752,forest fires,,california fires rage forest service sounds alarm rising wildfire costs,1,NEGATIVE,0.9876833558082581
5753,forest fires,,reddit lightning sparks new fires boise national forest rstormcoming,1,POSITIVE,0.869994580745697
5754,forest fires,san francisco,spread conflict sparked increase fires destroying,1,NEGATIVE,0.9867618083953857
5757,forest fires,cape cod,photo blue source,1,POSITIVE,0.8498231172561646
5758,forest fires,,im cook smokey bear saving forest fires face ass,0,NEGATIVE,0.942187488079071
5759,forest fires,nicola valley,forest fires amp dying salmon time 2 act deny climate change nightmares here,1,NEGATIVE,0.9308796525001526
5760,forest fires,tips blog,tales water loving tahoe fires,0,POSITIVE,0.9989193677902222
5763,forest fires,boise idaho,85 15 430 am progress being made noise forest fires,1,NEGATIVE,0.9366366863250732
5764,forest fires,,group florida forest service firefighters deployed california help contain fires details 10,1,POSITIVE,0.5302705764770508
5765,forest fires,,pray east coast forest fires pray put pray rain,1,NEGATIVE,0.9466347098350525
5766,forest fires,duncan,dumping water british columbia help forest fires,1,NEGATIVE,0.9920387268066406
5769,forest fires,,forest service says spending half budget fires,1,NEGATIVE,0.9986086487770081
5771,forest fires,texas,pharrell only can prevent forest fires,0,NEGATIVE,0.9825168251991272
5772,forest fires,,climate consequences forest service says spending half budget fires,1,NEGATIVE,0.9984059929847717
5775,forest fires,,forest service says spending half budget fires,1,NEGATIVE,0.9986086487770081
