id,keyword,location,text,target,sentiment,score
1,,,deeds reason may allah forgive,1,POSITIVE,0.9690797328948975
4,,,forest fire near la range ask canada,1,NEGATIVE,0.9607702493667603
5,,,residents asked shelter place being notified officers evacuation shelter place orders expected,1,NEGATIVE,0.9899757504463196
6,,,13000 people receive evacuation orders california,1,NEGATIVE,0.9547753930091858
7,,,just photo ruby smoke pours school,1,POSITIVE,0.9843775033950806
8,,,update california why closed directions due lake county fire,1,NEGATIVE,0.9934451580047607
10,,,heavy rain causes flash flooding streets manitou colorado springs areas,1,NEGATIVE,0.9262889623641968
13,,,im top hill can see fire woods,1,POSITIVE,0.9941149353981018
14,,,theres emergency evacuation happening now building across street,1,POSITIVE,0.7483317255973816
15,,,im afraid tornado coming area,1,NEGATIVE,0.974818766117096
16,,,people died heat wave far,1,NEGATIVE,0.9703402519226074
17,,,haha south tampa flooded hah wait second live south tampa am gon na am gon na fuck,1,NEGATIVE,0.9980740547180176
18,,,18 19 days ive lost count,1,NEGATIVE,0.9924772381782532
19,,,ago mandar arrived ago,1,POSITIVE,0.9526746273040771
20,,,damage school bus 80 multi car crash,1,NEGATIVE,0.9994637370109558
23,,,whats man,0,POSITIVE,0.9735084176063538
24,,,love fruits,0,POSITIVE,0.9997943043708801
25,,,summer lovely,0,POSITIVE,0.9998809099197388
26,,,car fast,0,POSITIVE,0.997534990310669
28,,,goooooooaaaaaal,0,NEGATIVE,0.9537119269371033
31,,,ridiculous,0,NEGATIVE,0.9996989965438843
32,,,london cool,0,POSITIVE,0.9998304843902588
33,,,love skiing,0,POSITIVE,0.999724805355072
34,,,wonderful day,0,POSITIVE,0.9998830556869507
36,,,looooool,0,POSITIVE,0.9688026309013367
37,,,way eat shit,0,NEGATIVE,0.9310829043388367
38,,,ny last week,0,POSITIVE,0.9936060905456543
39,,,love girlfriend,0,POSITIVE,0.9986469149589539
40,,,cool,0,POSITIVE,0.9998509883880615
41,,,like pasta,0,POSITIVE,0.966227114200592
44,,,end,0,NEGATIVE,0.9941535592079163
48,ablaze,birmingham,wholesale markets ablaze,1,NEGATIVE,0.9620159864425659
49,ablaze,est september 12 bristol,try bring heavy,0,NEGATIVE,0.9932658672332764
50,ablaze,africa,breaking newsnigeria flag set ablaze aba,1,NEGATIVE,0.8825113773345947
52,ablaze,philadelphia pa,crying set ablaze,0,NEGATIVE,0.9787590503692627
53,ablaze,london uk,plus side look sky last night ablaze,0,POSITIVE,0.9898316860198975
54,ablaze,pretoria,theyve built hype new acquisitions doubt will set el ablaze season,0,NEGATIVE,0.9707044959068298
55,ablaze,world wide,ine office asia set ablaze,1,POSITIVE,0.9416290521621704
56,ablaze,,barbados jamaica ûò cars set ablaze santa cruz ûó head st elizabeth police superintende,1,NEGATIVE,0.9187251329421997
57,ablaze,paranaque city,ablaze lord,0,POSITIVE,0.984645426273346
59,ablaze,live webcam,check,0,POSITIVE,0.9963366985321045
61,ablaze,,your ablaze alive your dead inside,0,POSITIVE,0.9403594136238098
62,ablaze,milky way,awesome time visiting cfo head office cop site ablaze thanks tits vida taking care,0,POSITIVE,0.9995757937431335
63,ablaze,,soooo pumped ablaze,0,POSITIVE,0.8088216781616211
64,ablaze,,wanted set chicago ablaze preaching hotel,0,NEGATIVE,0.9720532894134521
65,ablaze,,gained 3 followers last week know stats grow,0,POSITIVE,0.9486678838729858
66,ablaze,greensboronorth carolina,west burned thousands wildfires ablaze california alone,1,POSITIVE,0.7221893668174744
67,ablaze,,building perfect blacklist life leave streets ablaze,0,POSITIVE,0.8696481585502625
71,ablaze,england,first night retainers weird wear single night next year least,0,NEGATIVE,0.9859427809715271
73,ablaze,sheffield township ohio,deputies man shot brighton home set ablaze,1,NEGATIVE,0.7342111468315125
74,ablaze,india,man wife years jail setting ablaze niece,1,POSITIVE,0.5096506476402283
76,ablaze,barbados,santa cruz ûó head st elizabeth police superintendent lanford salmon,0,NEGATIVE,0.8818374276161194
77,ablaze,anaheim,police arsonist deliberately set black church north carolinaåêablaze,1,NEGATIVE,0.9964765906333923
78,ablaze,abuja,noches elbestia happy see teammates training hard goodnight gunners,0,POSITIVE,0.990088939666748
79,ablaze,usa,trampling turkey flag later set ablaze vandalized offices turkey front,1,NEGATIVE,0.9959084987640381
80,ablaze,south africa,truck ablaze r21 voortrekker ave tambo intl cargo section,1,NEGATIVE,0.9503203630447388
81,ablaze,sao paulo brazil,set hearts ablaze city gift skyline like kiss lips,0,POSITIVE,0.9994812607765198
82,ablaze,hollywoodland,sky ablaze tonight los angeles im expecting ig fu filled sunset shots know peeps,0,NEGATIVE,0.9575252532958984
83,ablaze,edmonton alberta treaty 6,west burned thousands wildfires ablaze alone,1,NEGATIVE,0.7244648933410645
85,ablaze,,revel wmv videos means mac farewell ablaze wmv en route dvd gtxrwm,0,NEGATIVE,0.9905117154121399
86,ablaze,inang pamantasan,progressive greetings month students set pens ablaze torch publications,0,NEGATIVE,0.9382926225662231
89,ablaze,twitter lockout progress,rene ablaze amp jacinta secret 2k13 fallen skies edit mar 30 13,0,POSITIVE,0.64515620470047
91,ablaze,concord ca,steve fires here california tinderbox clown setting hood ablaze,1,NEGATIVE,0.9791815280914307
92,ablaze,calgary ab,rene ablaze amp ian buff magnitude,0,POSITIVE,0.9270491003990173
93,ablaze,birmingham,huge fire wholesale markets ablaze,1,NEGATIVE,0.9374314546585083
95,ablaze,san francisco,time talk dont know can due work,0,NEGATIVE,0.9793954491615295
96,accident,clvlnd,kids cuz bicycle accident amp split testicles impossible kids michael father,0,NEGATIVE,0.9938691258430481
97,accident,nashville tn,accident i traffic moving am slower usual,1,NEGATIVE,0.998831570148468
98,accident,santa clara ca,accident center lane blocked us101 nb great america pkwy,1,NEGATIVE,0.9993471503257751
100,accident,uk,accident summer read advice amp see can help,0,NEGATIVE,0.9392985701560974
102,accident,st louis mo,speeding top causes teen accidents car accident teeth,0,NEGATIVE,0.9961162805557251
104,accident,walker county alabama,reported motor vehicle accident curry herman red near stephens involving overturned vehicle,1,NEGATIVE,0.9962666630744934
105,accident,australia,bigrigradio live accident awareness,1,NEGATIVE,0.5198957324028015
107,accident,north carolina,i77 mile marker 31 south mooresville iredell vehicle accident ramp closed 86 118 pm,1,NEGATIVE,0.9849706292152405
109,accident,,it sleeping pills double risk car accident,0,NEGATIVE,0.9948371648788452
110,accident,norf carolina,accident knew gon happen,0,NEGATIVE,0.9593677520751953
112,accident,san mateo county ca,traffic accident cabrillo hwymagellan av mir 080615 110358,1,NEGATIVE,0.9901555776596069
113,accident,north carolina,i77 mile marker 31 40 south mooresville iredell vehicle accident congestion 86 118 pm,1,NEGATIVE,0.9863059520721436
114,accident,njoro kenya,pastor scene accidentwho owner range rover,1,NEGATIVE,0.996590256690979
117,accident,,mom didn't home fast wished mom accident truck spilt mayonnaise,0,NEGATIVE,0.9975121021270752
118,accident,sisters bedroom,horrible car accident past sunday im finally able thank god,1,POSITIVE,0.8182288408279419
119,accident,,can wait see pissed donnie tell accident,0,NEGATIVE,0.998465895652771
120,accident,arlington tx,overturns interstate click here youve crash,1,NEGATIVE,0.998491644859314
121,accident,south bloomfield,accident 23 so so 752,1,NEGATIVE,0.992333173751831
126,accident,,carolina accident motorcyclist dies i540 crash car crossed median motorcycle rider traveling,1,NEGATIVE,0.9971285462379456
128,accident,new hanover county nc,fyi cadfyi accident property damagenhs999 piner rdhorndale dr,1,NEGATIVE,0.9983845949172974
129,accident,maldives,rt naayf first accident years turning chandanee magu near mma taxi rammed halfway turned confû,1,NEGATIVE,0.9954050779342651
130,accident,manchester nh,accident left lane blocked it 293 no eddy red traffic back nha delay 4 mins,1,NEGATIVE,0.9956575632095337
131,accident,wilmington nc,accident property damage piner rdhorndale dr,1,NEGATIVE,0.9993900060653687
132,accident,,accident,0,NEGATIVE,0.9995667338371277
133,accident,new hanover county nc,fyi cadfyi accident property damagewpd1600 17th st,1,NEGATIVE,0.9968435764312744
134,accident,,86 15 am traffic accident injury 2781 willis foreman red,1,NEGATIVE,0.9966022968292236
135,accident,global,aashiqui actress anu aggarwal nearfatal accident,1,NEGATIVE,0.9931260347366333
136,accident,alberta sask montana,outfield albert accident,1,NEGATIVE,0.9989789724349976
137,accident,charlotte,9 mile backup i77 southaccident blocking right 2 lanes exit 31 langtree rdconsider nc 115 nc 150 nc 16 alternate,1,NEGATIVE,0.9872298836708069
138,accident,baton rouge la,accident changed life will help determine options can financially support life care plans ongoing treatment,0,POSITIVE,0.8704217672348022
139,accident,hagerstown md,deadly motorcycle car accident happened today ill details 5,1,NEGATIVE,0.9983977675437927
141,accident,gloucestershire uk,marinating accident,0,NEGATIVE,0.9868326187133789
143,accident,,only car week fucking car accident ifs fucking drive,1,NEGATIVE,0.9979257583618164
144,accident,uk,police previously died road accident killed explosion,1,NEGATIVE,0.9852104783058167
145,accident,nairobi kenya,still heard church leaders kenya coming forward comment accident issue disciplinary measures,0,NEGATIVE,0.8078976273536682
146,aftershock,instagram,scum is live game ya,0,NEGATIVE,0.9951720833778381
149,aftershock,304,man who can drive once effort painful man who will win roger bannister,0,POSITIVE,0.998231828212738
151,aftershock,switzerland,3 ir iceman aftershock,0,NEGATIVE,0.9677671790122986
153,aftershock,304,victory bargain basement prices dwight david eisenhower,0,NEGATIVE,0.9870309233665466
156,aftershock,,3 ir iceman aftershock,0,NEGATIVE,0.9677671790122986
157,aftershock,304,remembers who came second charles schultz,0,POSITIVE,0.9886227250099182
158,aftershock,instagram,im speaking using scum be people will end is,0,NEGATIVE,0.996324360370636
159,aftershock,304,harder conflict glorious triumph thomas paine,0,POSITIVE,0.9992904663085938
160,aftershock,,going clay pigeon shooting crying aftershock,0,NEGATIVE,0.9978437423706055
161,aftershock,only know,guess actually wants free aftershock to,0,NEGATIVE,0.9872336387634277
162,aftershock,,aftershock terrifying best roller coaster ive disclaimer ive,0,POSITIVE,0.995851993560791
163,aftershock,belgium,aftershock,0,NEGATIVE,0.9545211791992188
164,aftershock,switzerland,3 ir iceman aftershock,0,NEGATIVE,0.9677671790122986
168,aftershock,,3 ir iceman aftershock,0,NEGATIVE,0.9677671790122986
170,aftershock,dope show,im seeing issues aftershock,0,NEGATIVE,0.9833869338035583
171,aftershock,switzerland,3 ir iceman aftershock,0,NEGATIVE,0.9677671790122986
173,aftershock,oshawa canada,bonus 5 minute daily habits improve life,0,POSITIVE,0.9989262223243713
174,aftershock,baker city oregon,aftershock protect profit next global financial meltdown david wieder help,0,POSITIVE,0.9831526279449463
175,aftershock,,moment scary roller coaster guy just screaming bloody murder,0,NEGATIVE,0.9865421056747437
176,aftershock,,aftershock ã¢ 10 fullã¢ streaming youtube,0,NEGATIVE,0.9860068559646606
178,aftershock,united states,get 15 aftershock protect profit next global financial,0,NEGATIVE,0.9042023420333862
180,aftershock,304,face difficulties your wrong your right joel seen,0,NEGATIVE,0.9969589710235596
182,aftershock,304,only stands dream will try belief actually possible joel brown,0,NEGATIVE,0.9690589308738708
183,aftershock,marysville ca,praise god ministry tells like,0,POSITIVE,0.9980875849723816
184,aftershock,304,remembering going die best way know avoid trap thinking lose ûò steve jobs,0,NEGATIVE,0.9937251210212708
185,aftershock,hermosa beach ca,tried orange aftershock today life will,0,POSITIVE,0.9956051707267761
187,aftershock,,love be,0,POSITIVE,0.9996975660324097
190,aftershock,,aftershock,0,NEGATIVE,0.9545211791992188
191,aftershock,,aftershock back school kick great want thank making possible great night,0,POSITIVE,0.9992237091064453
193,aftershock,304,people who say can interrupt who ûò george bernard shaw,0,NEGATIVE,0.9849193096160889
194,aftershock,304,first man oyster second man shell andrew carnegie,0,POSITIVE,0.9342796206474304
195,aftershock,,need pu tonight play hybrid slayer psi eu hum,0,NEGATIVE,0.9805083870887756
196,airplane accident,19600858 99047821,experts france begin examining airplane debris found reunion island french air accident experts,1,NEGATIVE,0.9104806780815125
197,airplane accident,pennsylvania,strict liability context airplane accident pilot error common component aviation or,1,NEGATIVE,0.9978493452072144
198,airplane accident,salt lake city utah,lifetime odds dying airplane accident 1 8015,0,NEGATIVE,0.9953137636184692
199,airplane accident,palo alto ca,experts france begin examining airplane debris found reunion island french air accident experts wed,1,NEGATIVE,0.9394631385803223
201,airplane accident,,aww there airplane accident there gon na die cuties job,1,NEGATIVE,0.9975710511207581
203,airplane accident,spain opalocka fl,family members osama bin laden died airplane accident ironic mommy gov shit suspect,1,NEGATIVE,0.9946618676185608
204,airplane accident,jaipur india,man goes airplane engine accident,1,NEGATIVE,0.9992535710334778
205,airplane accident,hyderabad telangana india,horrible accident man died wings airplane 2907 15,1,NEGATIVE,0.9967677593231201
208,airplane accident,eagle pass texas,cessna airplane accident ocampo coahuila mexico july 29 15 killed men including state coahuila government official,1,NEGATIVE,0.985517680644989
209,airplane accident,bangalore,man died wings airplane 2907 15,1,NEGATIVE,0.9845965504646301
210,airplane accident,financial news views,experts france begin examining airplane debris found reunion island french air accident experts wednesdays,1,NEGATIVE,0.9663786292076111
211,airplane accident,,experts france begin examining airplane debris found reunion island french air accident experts wednesday began examining,1,NEGATIVE,0.9421861171722412
212,airplane accident,indonesia,mbataweel family members who killed airplanes accident,1,NEGATIVE,0.9442266821861267
213,airplane accident,boyfriends legs,coworker nudes accident thank god airplane mode,0,NEGATIVE,0.993010938167572
215,airplane accident,new mexico usa,killed airplane accident night car wreck politics best,0,NEGATIVE,0.9900230765342712
216,airplane accident,,experts france begin examining airplane debris found reunion island french air accident experts,1,NEGATIVE,0.9104806780815125
218,airplane accident,,unbelievably insane,1,NEGATIVE,0.9727382659912109
219,airplane accident,mumbai india,horrible accident man died wings airplaneåê2907 15,1,NEGATIVE,0.9953821301460266
220,airplane accident,sri lanka,horrible accident man died wings airplane 2907 15,1,NEGATIVE,0.9967677593231201
221,airplane accident,resident,osama bin ladies family dead airplane crash naturally accident,1,NEGATIVE,0.9990098476409912
222,airplane accident,,pilot dies plane crash car festival,1,NEGATIVE,0.9947364926338196
225,airplane accident,lehigh valley pa,strict liability context airplane accident,1,NEGATIVE,0.9964499473571777
226,airplane accident,canada,don brazil experts france begin examining airplane debris found reunion island french air accident ex,1,NEGATIVE,0.9292469620704651
229,airplane accident,,experts france begin examining airplane debris found reunion island french air accident experts wed,1,NEGATIVE,0.9394631385803223
231,airplane accident,thrissur,horrible accident man died wings ûïairplaneû 2907 15 wtf canûªt believe eyes ûò,1,NEGATIVE,0.9952788352966309
232,airplane accident,havenford,nicole fletcher victim crashed airplane times ago accident left little bit trauma shes,1,NEGATIVE,0.9701799154281616
235,airplane accident,india,om horrible accident man died wings airplane,1,NEGATIVE,0.9985887408256531
237,airplane accident,92,dont believe bro,1,NEGATIVE,0.9879591464996338
240,airplane accident,israel,airplane accident,1,NEGATIVE,0.99937903881073
241,airplane accident,fashion heaven ig tmid,phone looks like car ship airplane accident terrible,0,NEGATIVE,0.9994345307350159
242,airplane accident,san francisco ca,statistically im risk killed cop am dying airplane accident,0,NEGATIVE,0.9958332180976868
243,airplane accident,italy,airplane crashes house colombia 12 people die accident,1,NEGATIVE,0.9979142546653748
244,airplane accident,nyc,shooting airplane accident,1,NEGATIVE,0.9965307116508484
245,airplane accident,toronto,drone cause airplane accident pilots worried drones esp close vicinity airports,1,NEGATIVE,0.9974133372306824
246,ambulance,,early wake call sister begging come amp ride wher ambulance hospital,1,NEGATIVE,0.990638256072998
247,ambulance,jackson,twelve feared killed pakistani air ambulance helicopter crash,1,NEGATIVE,0.991507887840271
248,ambulance,new york worldwide,air ambulances scene crash cars lorry,1,NEGATIVE,0.9960261583328247
249,ambulance,,twelve feared killed pakistani air ambulance helicopter crash reuters,1,NEGATIVE,0.9702437520027161
251,ambulance,new orleans la,leading emergency services boss welcomes new ambulance charity,0,POSITIVE,0.9957641363143921
252,ambulance,west wales,travelling aberystwythshrewsbury right now theres incident services halt just shrews ambulance scene,1,NEGATIVE,0.9918534159660339
253,ambulance,,twelve feared killed pakistani air ambulance helicopter crash,1,NEGATIVE,0.991507887840271
254,ambulance,happily married 2 kids,ambulance sprinter automatic frontline vehicle choice 14 lez compliant ebay,0,NEGATIVE,0.9829711318016052
256,ambulance,cambridge ma,new nanotech device will able target destroy blood clots,0,POSITIVE,0.9820961952209473
258,ambulance,arizona,skyhawkmm hella crazy 3 fights ambulance couple mosh pits,1,NEGATIVE,0.9922884106636047
260,ambulance,mumbai,run ambulance am lucky,0,POSITIVE,0.9799304008483887
261,ambulance,,twelve feared killed pakistani air ambulance helicopter crash,1,NEGATIVE,0.991507887840271
262,ambulance,amsterdam,twelve feared killed pakistani air ambulance helicopter crash,1,NEGATIVE,0.991507887840271
263,ambulance,swindonengland,waiting ambulance,0,NEGATIVE,0.9799200892448425
264,ambulance,,ok need ambulance hahaha,0,NEGATIVE,0.7342149019241333
265,ambulance,happily married 2 kids,ambulance sprinter automatic frontline vehicle choice 14 lez compliant ebay,0,NEGATIVE,0.9829711318016052
266,ambulance,,pakistan air ambulance helicopter crash kills,1,NEGATIVE,0.9991610050201416
267,ambulance,williamstown vt,pissant ok need medical assistance can call ambulance need,0,NEGATIVE,0.9925590753555298
268,ambulance,north carolina usa,ems1 ny emts petition 17 hour û÷minimum wageûª,0,NEGATIVE,0.9858371019363403
269,ambulance,,twelve feared killed pakistani air ambulance helicopter crash,1,NEGATIVE,0.991507887840271
270,ambulance,karachi,twelve feared killed pakistani air ambulance helicopter crash,1,NEGATIVE,0.991507887840271
271,ambulance,happily married 2 kids,ambulance sprinter automatic frontline vehicle choice 14 lez compliant ebay,0,NEGATIVE,0.9829711318016052
272,ambulance,happily married 2 kids,ambulance sprinter automatic frontline vehicle choice 14 lez compliant ebay,0,NEGATIVE,0.9829711318016052
273,ambulance,loveland colorado,check whats parking last year ambulance it johns,0,NEGATIVE,0.9944978356361389
274,ambulance,,dont know way ambulance coming lilt,1,NEGATIVE,0.9762093424797058
276,ambulance,,twelve feared killed pakistani air ambulance helicopter crash,1,NEGATIVE,0.991507887840271
277,ambulance,,twelve feared killed pakistani air ambulance helicopter crash,1,NEGATIVE,0.991507887840271
279,ambulance,,ambulance right work,0,POSITIVE,0.9987576007843018
280,ambulance,canada,ûï dog thinks hes ambulance,0,NEGATIVE,0.9951058626174927
281,ambulance,visit youtube channel,happening now hatzolah ems ambulance responding dual sirens andû,0,NEGATIVE,0.8861225843429565
283,ambulance,lexington,twelve feared killed pakistani air ambulance helicopter crash,1,NEGATIVE,0.991507887840271
285,ambulance,,twelve feared killed pakistani air ambulance helicopter crash,1,NEGATIVE,0.991507887840271
287,ambulance,usa,twelve feared killed pakistani air ambulance helicopter crash,1,NEGATIVE,0.991507887840271
289,ambulance,hannover germany,twelve feared killed pakistani air ambulance helicopter crash,1,NEGATIVE,0.991507887840271
290,ambulance,,whats police ambulance number desoto body know,0,NEGATIVE,0.9758327603340149
291,ambulance,,am surprised still can standardised clinical practice across 11 nos ambulance trust,0,POSITIVE,0.9924159049987793
293,ambulance,playa,twelve feared killed pakistani air ambulance helicopter crash,1,NEGATIVE,0.991507887840271
294,ambulance,davidson nc,people who try walk ambulance passing hate,0,NEGATIVE,0.9974798560142517
296,annihilated,higher places,episode trunks annihilated freeze cleanest shit showed nigga mercy,0,NEGATIVE,0.9953879714012146
297,annihilated,horsemind mi,annihilated petebests dessicated laid bare kneel,0,NEGATIVE,0.990213930606842
298,annihilated,new york ny,tribe just annihilated baseball,0,NEGATIVE,0.9953840374946594
299,annihilated,boksburg,heysundowns annihilated previous meeting celticindeed improvement,0,NEGATIVE,0.8118324875831604
301,annihilated,,mizzou annihilated florida past 2 seasons ended muschamps career just compete bama,0,NEGATIVE,0.9932045936584473
302,annihilated,,annihilated abs,1,NEGATIVE,0.8925017714500427
303,annihilated,,annihilated status education mba behalf easy street careen love,0,POSITIVE,0.6198232173919678
307,annihilated,vrp mv au r18,luka die annihilated lois tracy,0,NEGATIVE,0.8564486503601074
309,annihilated,greater manchester uk,un fella sorry wont annihilated,0,NEGATIVE,0.9682465195655823
310,annihilated,boston,cop pulls drunk driver safety seconds car hit train,1,NEGATIVE,0.9857051372528076
312,annihilated,,annihilated,0,NEGATIVE,0.9827759265899658
313,annihilated,,cop pulls drunk driver safety seconds car hit train,1,NEGATIVE,0.9857051372528076
314,annihilated,canopy kingdom,boom country just entirely annihilated hû ûó britain,0,NEGATIVE,0.6685041189193726
315,annihilated,,annihilated well thank,0,POSITIVE,0.999616265296936
316,annihilated,usa,surgeon promised israel will annihilated butthe horror iran nukes,0,NEGATIVE,0.9438565373420715
318,annihilated,,guess thats ok armenians weve spent history annihilated,1,NEGATIVE,0.9873079657554626
320,annihilated,,70 years annihilated 100000 people instantly aware ability annihilate whole humanity,1,POSITIVE,0.9976296424865723
321,annihilated,zone layer,day 1 tryouts went minus quickly short ball annihilated toenail injury,0,NEGATIVE,0.9860309362411499
322,annihilated,london,1960s oryx symbol arabian peninsula annihilated hunters,1,POSITIVE,0.552358090877533
327,annihilated,trancy manor,luka die annihilated lois tracy,0,NEGATIVE,0.8564486503601074
328,annihilated,,ready annihilated bus game,1,NEGATIVE,0.9976050853729248
329,annihilated,south 37,people annihilated last nights weather philip thought forecast,1,POSITIVE,0.5085452795028687
330,annihilated,,domain sophistication annihilated closely uptotheminute feat zrnf,0,POSITIVE,0.9965590834617615
331,annihilated,west lancashire uk,seen judas priest 05 rob came back scorpions support fucking annihilated place astonishing gig,0,POSITIVE,0.9768575429916382
332,annihilated,pa,officially skipping hashtag annihilated reviews bummer,0,NEGATIVE,0.9997186064720154
334,annihilated,,explaining annihilated case only survivor evolved godlike,1,NEGATIVE,0.9004446268081665
335,annihilated,û¢ views û¢,just completely annihilated tech paul began time alive,0,NEGATIVE,0.9583650827407837
336,annihilated,,who annihilated legion survivors imperfect hybrid project quickly formed new secret cell,0,POSITIVE,0.8244158029556274
337,annihilated,university toronto,exactly thats lesnarcena match summerslam last year great brock annihilated guy whos,0,NEGATIVE,0.799099326133728
338,annihilated,,cop pulls drunk driver safety seconds car hit train,1,NEGATIVE,0.9857051372528076
340,annihilated,swaning,annihilated damascus syrian army grinds û÷alloosh gang manure pile,1,NEGATIVE,0.9979948997497559
341,annihilated,,ok wasnt completely forthright may food coma bc kebabtahinipickles annihilated wfries,0,NEGATIVE,0.9976696372032166
344,annihilated,london,fun filled happyhour simmons bar camden handsome annihilated game,0,POSITIVE,0.9991931319236755
345,annihilated,albanyny,funny bristol so annihilated ball,0,POSITIVE,0.9731218218803406
346,annihilation,california usa,hell just fraction belief total annihilation destruction usa,1,NEGATIVE,0.9891490340232849
347,annihilation,,maybe call israel tell sorry pres sold down river annihilation,0,NEGATIVE,0.9981112480163574
348,annihilation,,evildead annihilation civilization,0,NEGATIVE,0.9959844350814819
349,annihilation,,national park services onto national forest annihilation salt river wild horse,0,NEGATIVE,0.9560972452163696
352,annihilation,wild wild web,annihilating quarterstaff annihilation,1,NEGATIVE,0.9983705878257751
353,annihilation,subconscious la,world annihilation self transformation aliens attack exterminate humans,0,NEGATIVE,0.9787337779998779
354,annihilation,spain,stardate stardate 3 planetary annihilation,1,NEGATIVE,0.9886130094528198
355,annihilation,,national park services onto national forest annihilation salt river wild horse,0,NEGATIVE,0.9560972452163696
356,annihilation,ca physically boston strong,national park services onto national forest annihilation salt river wild horse,1,NEGATIVE,0.9560972452163696
358,annihilation,yeezy taught nv,can sign share petition save wild horses arizona,0,POSITIVE,0.6053101420402527
360,annihilation,,national park services onto national forest annihilation salt river wild horse,1,NEGATIVE,0.9560972452163696
