id,keyword,location,text,target,sentiment,score
7842,quarantine,world,reddit will now quarantine offensive content,0,NEGATIVE,0.9994342923164368
7843,quarantine,,reddit will now quarantine offensiveåêcontent,0,NEGATIVE,0.9928730726242065
7844,quarantine,,reddit will now quarantine offensive content,1,NEGATIVE,0.9994342923164368
7847,quarantined,,top link reddits new content policy goes effect horrible subreddits banned quarantined,0,NEGATIVE,0.9995365142822266
7848,quarantined,,quarantined little corner be sick office work piling need kinda day,0,NEGATIVE,0.9818682670593262
7849,quarantined,cumming ga,reddits new content policy goes effect horrible subreddits banned quarantined,0,NEGATIVE,0.9993595480918884
7850,quarantined,korea,top link reddits new content policy goes effect horrible subreddits banned quarantined,0,NEGATIVE,0.9995365142822266
7851,quarantined,south africa,reddits new content policy goes effect horrible subreddits banned quarantined,0,NEGATIVE,0.9993595480918884
7852,quarantined,san francisco,officials alabama home quarantined possible ebola case,1,NEGATIVE,0.9549511671066284
7854,quarantined,russia,reddits new content policy goes effect horrible subreddits banned quarantined,0,NEGATIVE,0.9993595480918884
7855,quarantined,california,reddits new content policy goes effect horrible subreddits banned quarantined,0,NEGATIVE,0.9993595480918884
7857,quarantined,,here ebola run lives aaarrrgghhh,1,NEGATIVE,0.9959422945976257
7860,quarantined,sarasota fl,reddits new content policy goes effect horrible subreddits banned quarantined,1,NEGATIVE,0.9993595480918884
7861,quarantined,,fucking yes rantipozi quarantined triggered cucks,0,NEGATIVE,0.9774291515350342
7862,quarantined,melbourne,reddits new content policy goes effect horrible subreddits banned quarantined,1,NEGATIVE,0.9993595480918884
7863,quarantined,livonia mi,reddits new content policy goes effect horrible subreddits banned quarantined,0,NEGATIVE,0.9993595480918884
7864,quarantined,,users sub quarantined,0,NEGATIVE,0.9839838743209839
7865,quarantined,,officials alabama home quarantined possible,1,NEGATIVE,0.9820115566253662
7867,quarantined,usa,calling now kia banned quarantined months end,0,NEGATIVE,0.9799818992614746
7868,quarantined,karolinska vìgen 18 solna,officials say quarantine place birmingham home possible ebola case edward khan,1,NEGATIVE,0.9749027490615845
7869,quarantined,,gmtty mhtw4fnet officials alabama home quarantined possible ebola case washington times,1,NEGATIVE,0.9945130348205566
7870,quarantined,,top link reddits new content policy goes effect horrible subreddits banned quarantined,0,NEGATIVE,0.9995365142822266
7871,quarantined,,reddits new content policy goes effect horrible subreddits banned quarantined,0,NEGATIVE,0.9993595480918884
7872,quarantined,china,top link reddits new content policy goes effect horrible subreddits banned quarantined,0,NEGATIVE,0.9995365142822266
7873,quarantined,,alabama home quarantined possible ebola case officials say quarantine place,1,NEGATIVE,0.9832079410552979
7874,quarantined,heard,he it alabama home quarantined possible ebola case,1,NEGATIVE,0.9233494997024536
7876,quarantined,,im just going say new reddit policy changes think conspiracy will quarantined thats bad truth my,0,NEGATIVE,0.9995571970939636
7877,quarantined,dunwoody ga,okay cat quarantined bathroomits meowing loud turned tv louderthings just work okay,0,POSITIVE,0.9810414910316467
7878,quarantined,,alabama firefighters quarantined possible ebola exposure reports,1,NEGATIVE,0.9527061581611633
7880,quarantined,,0npzp mhtw4fnet officials alabama home quarantined possible ebola case abc news,1,NEGATIVE,0.9861326217651367
7881,quarantined,ebola,alabama home quarantined possible case ambulance sat university alabama at,1,NEGATIVE,0.9778028726577759
7882,quarantined,mongolia,reddits new content policy goes effect horrible subreddits banned quarantined,0,NEGATIVE,0.9993595480918884
7883,quarantined,,reddits new content policy goes effect horrible subreddits banned quarantined,0,NEGATIVE,0.9993595480918884
7885,quarantined,broadview heights ohio,hey concept quarantine makes sense people youve quarantined can just wander amp want,0,NEGATIVE,0.9865401387214661
7887,quarantined,,ebola alabama home quarantined possible ebola case articles,1,NEGATIVE,0.9860836863517761
7888,quarantined,,oc73x mhtw4fnet officials alabama home quarantined possible ebola case washington post,1,NEGATIVE,0.9878472089767456
7889,quarantined,china,top link reddits new content policy goes effect horrible subreddits banned quarantined,0,NEGATIVE,0.9995365142822266
7891,quarantined,poplar london,do patch fix error semantic quarantined computer ergo wireless exchange lol technology,0,NEGATIVE,0.9985938668251038
7893,quarantined,rome,top link reddits new content policy goes effect horrible subreddits banned quarantined,0,NEGATIVE,0.9995365142822266
7894,quarantined,china,reddits new content policy goes effect horrible subreddits banned quarantined,0,NEGATIVE,0.9993595480918884
7895,radiation emergency,lp mn usa,nuclear emergency current usa radiation levels monitoring site,0,NEGATIVE,0.9431019425392151
7897,radiation emergency,,liked video canada radiation update emergency fishing closures,1,NEGATIVE,0.9254119992256165
7898,radiation emergency,,wipe emergency activated slightly elevated levels radiation,1,NEGATIVE,0.8788402080535889
7902,radiation emergency,burlington vt,worst radiation exposure fukushima meltdown happened 47km northwestproof small emergency planning zones donûªt cut,1,NEGATIVE,0.9983153343200684
7903,radiation emergency,la grange park il,wipe facility no investigating site filter radiation reading activated emergency ops center says offsite release,0,NEGATIVE,0.9972904920578003
7905,radiation emergency,warszawa,radioactive box quarantined israelûªs ashdod port evacuated emergency teams discovered radiation emittin,1,NEGATIVE,0.992155134677887
7906,radiation emergency,washington dc,radiation emergency starts knowing inside stay inside stay tuned,1,NEGATIVE,0.7508015632629395
7907,radiation emergency,,who wants documents radiation emergency procedures 06 24 09,0,NEGATIVE,0.9906502962112427
7908,radiation emergency,,nuclear emergency tracking center,0,NEGATIVE,0.6891850829124451
7909,rainstorm,darnley prince edward island,due rainstorm last night cupcake decorating happening now rec hall 2 proceeds,0,NEGATIVE,0.8734849691390991
7910,rainstorm,gloucester ma,rainstorm downtown gloucester,1,POSITIVE,0.9922357201576233
7912,rainstorm,vancouver usa,ltgaspgt forgot sunday omg,0,NEGATIVE,0.9958226680755615
7913,rainstorm,alberta,wow beauty lies storm taken today rainstorm camp pipelines,1,POSITIVE,0.9888592958450317
7914,rainstorm,yobe state,rainstorm destroys 600 houses robe state rainstorm destroys 600 houses robe state daily trust damage,1,NEGATIVE,0.9995191097259521
7915,rainstorm,coventry rhode island,going beach jim elves means guaranteed rainstorm,0,POSITIVE,0.9868978261947632
7916,rainstorm,,edge jimmy summer rainstorm papaya sounds,0,POSITIVE,0.9959272742271423
7918,rainstorm,united states america,severe caused,1,NEGATIVE,0.9983293414115906
7923,rainstorm,,landslide italian alps kills rome reuters people killed severe rainstorm the,1,NEGATIVE,0.9960314631462097
7924,rainstorm,federal capital territory,rainstorm destroys 600 houses robe reporter,1,NEGATIVE,0.9994992017745972
7926,rainstorm,la puente ca,stuck rainstorm stay middle road streets crowned water tends pool sides,0,NEGATIVE,0.9896743893623352
7929,rainstorm,music,major rainstorm happening im gon na lie down drift away storming little bebacksoon,1,NEGATIVE,0.9932779669761658
7930,rainstorm,online,landslide italian alps kills rome reuters people killed severe rainstorm,1,NEGATIVE,0.9960319399833679
7932,rainstorm,memphis tn,roar waves rainstorm amp rolling,0,POSITIVE,0.9913010001182556
7933,rainstorm,,robotrainstorm vacancies fantasy football team join itûªs fun,0,POSITIVE,0.9984334111213684
7934,rainstorm,,look like caught rainstorm amazing disgusting time,0,POSITIVE,0.832434892654419
7935,rainstorm,,rainstorm update north south,1,POSITIVE,0.89438396692276
7936,rainstorm,thailand malaysia indonesia,nigeria rainstorm destroys 600 houses yobe state daily trust damaturu 600û,1,NEGATIVE,0.9994369149208069
7937,rainstorm,earth,landslide italian alps kills rome reuters people killed severe rainstorm the,1,NEGATIVE,0.9960314631462097
7938,rainstorm,pennsylvania usa,rain rain away soaked way it it,0,NEGATIVE,0.9514635801315308
7939,rainstorm,vancouver usa,,0,POSITIVE,0.7481211423873901
7940,rainstorm,fairfax va,tomorrows evening commute receives red light rainstorm impacting region will push way late evening,1,POSITIVE,0.9767338037490845
7941,rainstorm,memphis tn,rainstorm didn't last nearly long,1,NEGATIVE,0.971574604511261
7943,rainstorm,seattle,import interested fonts there using,0,NEGATIVE,0.9610687494277954
7944,rainstorm,sicamous british columbia,lizzie363 drove deep water flash floodrainstorm repair cost 14000 25 yrs later people still thnk cars float,1,NEGATIVE,0.987962543964386
7945,rainstorm,north memphisglobal citizen,best believe wrong decisions being made here memphis streets here rainstorm lol folk,0,NEGATIVE,0.9872428178787231
7949,rainstorm,bridport england,want rainstorm,0,NEGATIVE,0.5885140895843506
7950,rainstorm,porto alegre rio grande sul,waking sick rainstorm sad today put kooks stereo lets,0,NEGATIVE,0.9957952499389648
7952,rainstorm,north vancouver bc,yay can feel wind gearing rainstorm bring,1,POSITIVE,0.9965924620628357
7953,rainstorm,seattle,im huge football fan know ive fantasy leagues patience newbie,0,POSITIVE,0.9973576664924622
7954,rainstorm,pioneer village ky,way move like full rainstorm im house cards,1,POSITIVE,0.9987063407897949
7955,rainstorm,port harcourt nigeria,rainstorm destroys 600 houses robe state,1,NEGATIVE,0.9995682835578918
7957,rainstorm,ecsu16,way move like full rainstorm im house cards,0,POSITIVE,0.9987063407897949
7958,rainstorm,uk,landslide caused severe rainstorm kills 3 italianåêalps,1,NEGATIVE,0.9909454584121704
7959,razed,,freedom surfs razed way new homes,0,NEGATIVE,0.6147791147232056
7960,razed,,latest homes razed northern california wildfire abc news,1,NEGATIVE,0.988434910774231
7962,razed,nigeria,tension abia inec officeûªs razedåêûò governor ikpeazu pdp apga react,1,NEGATIVE,0.9940165281295776
7963,razed,tulsa ok,latest homes razed northern california wildfire latest wildfires burning california and,1,NEGATIVE,0.881435751914978
7965,razed,,latest homes razed northern california wildfire,1,NEGATIVE,0.9853280186653137
7968,razed,,latest homes razed northern california wildfire abc news,1,NEGATIVE,0.988434910774231
7969,razed,,latest homes razed northern california wildfire abc news,1,NEGATIVE,0.988434910774231
7970,razed,,latest homes razed northern california wildfire lynchburg news advance,1,NEGATIVE,0.9868349432945251
7971,razed,worldwide,latest homes razed northern california wildfire new york times,1,NEGATIVE,0.9725775718688965
7972,razed,,latest homes razed northern california wildfire abc news,1,NEGATIVE,0.988434910774231
7973,razed,,latest homes razed northern california wildfire abc news,1,NEGATIVE,0.988434910774231
7976,razed,,latest homes razed northern california wildfire,1,NEGATIVE,0.9853280186653137
7977,razed,,latest homes razed northern california wildfire,1,NEGATIVE,0.9853280186653137
7978,razed,,latest homes razed northern california wildfire,1,NEGATIVE,0.9853280186653137
7980,razed,north,significant think iconic pic church maybe ruins substantial efforts razed,0,NEGATIVE,0.9978207349777222
7981,razed,,latest homes razed northern california wildfire,1,NEGATIVE,0.9853280186653137
7982,razed,,latest homes razed northern california wildfire,1,NEGATIVE,0.9853280186653137
7983,razed,,latest homes razed northern california wildfire abc news,1,NEGATIVE,0.988434910774231
7984,razed,ames ia,least sincere,1,NEGATIVE,0.9968913197517395
7987,razed,,latest homes razed northern california wildfire abc news,1,NEGATIVE,0.988434910774231
7988,razed,,latest homes razed northern california wildfire abc news,1,NEGATIVE,0.988434910774231
7989,razed,,latest homes razed northern california wildfire,1,NEGATIVE,0.9853280186653137
7990,razed,san diego california 92101,homes razed northern calf wildfire,1,NEGATIVE,0.9954822063446045
7991,razed,nairobikenya,george jenna hero burning friend razing wildfire,1,NEGATIVE,0.975100576877594
7992,razed,erie pa,today will dualcom enjoyed yesterdays check todays 5 pm easter,0,POSITIVE,0.9826756715774536
7994,razed,,latest homes razed northern california wildfire abc news,1,NEGATIVE,0.988434910774231
7996,razed,,latest homes razed northern california wildfire abc news,1,NEGATIVE,0.988434910774231
7999,razed,,latest homes razed northern california wildfire abc news,1,NEGATIVE,0.988434910774231
8000,razed,,latest homes razed northern california wildfire abc news,1,NEGATIVE,0.988434910774231
8001,razed,,latest homes razed wildfire,1,NEGATIVE,0.993787407875061
8002,razed,,latest homes razed northern california wildfire,1,NEGATIVE,0.9853280186653137
8003,razed,nairobikenya,george jenna hero burning friend razing wildfire,1,NEGATIVE,0.975100576877594
8005,razed,,latest homes razed northern california wildfire,1,NEGATIVE,0.9853280186653137
8006,razed,,latest homes razed northern california wildfire abc news,1,NEGATIVE,0.988434910774231
8008,razed,augusta maine 04330,vassalboro house razed way public gazebo reports,0,NEGATIVE,0.998505711555481
8009,refugees,,justmarried turkish couple gave 4000 syrian refugees incredible gift fed family amp friends,1,POSITIVE,0.9984539747238159
8010,refugees,ad majorem dei glorium,police monitoring 0 jihadis poland,1,NEGATIVE,0.9398171901702881
8012,refugees,aurora ontario,turkish newlyweds donate wedding money beautiful gesture still faith humanity,0,POSITIVE,0.9996850490570068
8013,refugees,baku erzurum,justmarried turkish couple gave 4000 syrian refugees incredible gift,1,POSITIVE,0.9997593760490417
8015,refugees,statute limitations,repulsive refugeesvictimiser evangelicalliar dupe press overdrive,0,NEGATIVE,0.9959242343902588
8016,refugees,paradise,cameron repatriating 1 00 nigerian refugees due boko haram,1,NEGATIVE,0.9546944499015808
8017,refugees,bc asia europe,newlyweds feed syrian refugees wedding abc news latest canada world entertainment business news,0,POSITIVE,0.7742395997047424
8018,refugees,,wow 1 00 nigerian refugees repatriated cameron,1,POSITIVE,0.9668022990226746
8019,refugees,,him 1 00 nigerian refugees repatriated cameron,1,NEGATIVE,0.9233152270317078
8020,refugees,,what 1 00 nigerian refugees repatriated cameron,1,NEGATIVE,0.9231815338134766
8021,refugees,st petersburgfl,imagine entire aisle dedicated making people look like serbian refugees director whole foods clothing section,0,NEGATIVE,0.9846760630607605
8023,refugees,espaì±a,couple spend wedding day feeding 4000 syrian refugees see,0,POSITIVE,0.9953604340553284
8024,refugees,,read less 1 00 nigerian refugees repatriated cameron,1,NEGATIVE,0.9900593161582947
8025,refugees,tarragona,top story couple spend wedding day feeding 4000 syrian refugees see,0,POSITIVE,0.9967471361160278
8026,refugees,,refugee connections indiegogo campaign will going live tomorrow support help launch only online community,1,NEGATIVE,0.9687663912773132
8028,refugees,,yall read 1 00 nigerian refugees repatriated cameron,1,NEGATIVE,0.9801574349403381
8029,refugees,,short throwing overboard dont think leader worse worst am,1,NEGATIVE,0.99950110912323
8030,refugees,warri,cameron repatriated 1 00 nigerian refugees,1,NEGATIVE,0.7475697994232178
8031,refugees,melbourne australia,captain abbott down lap boat,0,NEGATIVE,0.8849849700927734
8032,refugees,,turkish couple spent wedding day feeding 4000 syrian refugees turkish couple who married i,0,POSITIVE,0.9412983655929565
8034,refugees,2146244615802 17,couple using drones save refugees worlds deadliest border,1,NEGATIVE,0.9732893705368042
8035,refugees,,what 1 00 nigerian refugees repatriated cameron,1,NEGATIVE,0.9231815338134766
8036,refugees,,him 1 00 nigerian refugees repatriated cameron,1,NEGATIVE,0.9233152270317078
8037,refugees,bangalore india,couple decided feed 4000 part celebrations,0,POSITIVE,0.9831515550613403
8038,refugees,skyhold,it right now years still refugees camped just south radcliffe village aidan it,1,NEGATIVE,0.8341953754425049
8039,refugees,australia,newlyweds feed thousands syrian refugees hosting banquet wedding dinner,0,POSITIVE,0.9321220517158508
8040,refugees,ammanjordan,photos young refugees forced flee burundis violence vice news see,1,NEGATIVE,0.9013860821723938
8043,refugees,tripoli international airport,thank helping people need world i,0,POSITIVE,0.999790370464325
8045,refugees,,newlyweds feed thousands syrian refugees hosting banquet wedding dinner,1,POSITIVE,0.9321220517158508
8047,refugees,auckland new zealand,panic media centre articles australia ref protests new security gag reporting,0,NEGATIVE,0.9919003248214722
8049,refugees,,recap 1 00 nigerian refugees repatriated cameron,1,NEGATIVE,0.8992845416069031
8055,refugees,nycus cali colombia,generous bride earth couple feeds 4000 syrian refugees wedding day love,0,POSITIVE,0.9997325539588928
8056,refugees,,what 1 00 nigerian refugees repatriated cameron,1,NEGATIVE,0.9231815338134766
8057,refugees,qld australia,46 returned refugees fleeing amp will vietnamese govt treat now returned,1,NEGATIVE,0.7307187914848328
8058,refugees,geneva switzerland,chpsre rt refugees followers paris visit dream humanity exhibition rezaphotography û û,1,POSITIVE,0.9332908987998962
8060,rescue,trinidad tobago,policyholders object clico rescue plan,1,NEGATIVE,0.9596672654151917
8061,rescue,sf bay area,dont panic rescue,0,POSITIVE,0.8758190274238586
8062,rescue,,coastal german shepherd rescue of shared link,0,POSITIVE,0.6120436787605286
8064,rescue,toronto ontario,ud rescue structural collapse scott road ypres road york 14 trucks,1,NEGATIVE,0.9962865114212036
8065,rescue,new jersey,rescue day itûªs world cat day saturday aug 8th black blackwhite cats just 5,0,NEGATIVE,0.9772024750709534
8066,rescue,big northeast litter box,im 2 blood pressure meds still roof long story broke involved animal rescue,0,NEGATIVE,0.9870049357414246
8067,rescue,sand springs oklahoma,coastal german shepherd rescue of shared link,0,POSITIVE,0.6120436787605286
8068,rescue,,coastal german shepherd rescue of shared link ecstatic rescued rocco,0,POSITIVE,0.9043871760368347
8069,rescue,,suggest amp vivian rescue,0,POSITIVE,0.7649814486503601
8070,rescue,surry hills sydney,lengths rescue cat need,0,NEGATIVE,0.778944730758667
8071,rescue,sand springs oklahoma,last chance animal rescue 3 new posts,0,POSITIVE,0.9749915599822998
8073,rescue,,last chance animal rescue 3 new posts,0,POSITIVE,0.9749915599822998
8074,rescue,,sammy todd rescue may uniform still rescue lao of fam,0,NEGATIVE,0.9230281114578247
8079,rescue,usa,lunch crew made night night long day peaceloverescue,0,NEGATIVE,0.6373711824417114
8081,rescue,thornton colorado,tell united nations plantations forests,0,NEGATIVE,0.8797353506088257
8083,rescue,wanderlust,mary coming troy rescue,0,POSITIVE,0.8838755488395691
8085,rescue,karachi,floodzone general raheel sharif visits chitral lauded efforts fwo army troops army aviation rescue opera,1,POSITIVE,0.9865628480911255
8087,rescue,,last chance animal rescue 3 new posts,0,POSITIVE,0.9749915599822998
8088,rescue,,dogs rescue dogs,0,POSITIVE,0.6607969999313354
8089,rescue,india,officials rescue 367 migrants libya 25 bodies found fox news,1,NEGATIVE,0.961186945438385
8091,rescue,usa fema region 5,coastal german shepherd rescue of shared link,0,POSITIVE,0.6120436787605286
8094,rescued,united states,sabrina dad rescued dude who kept cage weve 4,1,POSITIVE,0.9677790403366089
8095,rescued,,britons rescued himalayan floods,1,POSITIVE,0.9919468760490417
8096,rescued,nigeria,4 kidnapped ladies rescued police enough nigerian tribune,1,NEGATIVE,0.5164632797241211
8097,rescued,jakarta,rescued med migrants arrive sicily,1,POSITIVE,0.9704071283340454
8098,rescued,ohio usa,hand glass water sit down rescued tengo ive lived ship dojo year,0,POSITIVE,0.9326125979423523
8100,rescued,watford,trust rescued dopey ones val hilarious shame shes going die,0,POSITIVE,0.7733250856399536
8101,rescued,west hollywood,summer,0,POSITIVE,0.9989953637123108
8102,rescued,kent,man who buried dog alive thought find rescued just time,0,NEGATIVE,0.959407389163971
8103,rescued,canada,10monthold baby girl rescued coastguard floated half mile sea,1,NEGATIVE,0.9388763904571533
8105,rescued,multiverse,now awaits rescuedagain,0,POSITIVE,0.8886120319366455
8106,rescued,usa,rescued med migrants arrive sicily,1,POSITIVE,0.9704071283340454
8109,rescued,bournemouth,finnish hip hop pioneer paleface will rescued drifting raft brought container later,0,NEGATIVE,0.8916743397712708
8110,rescued,jammu kashmir delhi,18 bovines rescued 3 smugglersåênabbed,1,POSITIVE,0.7980530858039856
8111,rescued,,funds needed rescued abandoned cocker spaniel,0,NEGATIVE,0.9908775687217712
8112,rescued,,liked video romanatwoodvlogs rescued sick kittens,0,POSITIVE,0.9682853817939758
8113,rescued,,britons rescued himalayan floods,1,POSITIVE,0.9919468760490417
8116,rescued,southern california,brave little dog rescued river recovery will inspire,0,POSITIVE,0.9998130202293396
8118,rescued,philadelphia pennsylvania usa,homeless man traveling across usa 11 stray dogs rescued helping hand strangers,0,NEGATIVE,0.6444578170776367
8119,rescued,,breaking news tonight kids rescued play room week food water parents sex life haha,1,NEGATIVE,0.9444308876991272
8120,rescued,winstonsalem nc,can only rescued actually pretend giorgio hit,0,NEGATIVE,0.9950883984565735
8121,rescued,huntley il,rescued dog least 9 years ago shes old still sweet,0,POSITIVE,0.9977896213531494
8122,rescued,nigeria,rescued med migrants arrive sicily hundreds migrants rescued,1,POSITIVE,0.9687077403068542
8125,rescued,green pleasant land,werent taken back africa once rescued,1,NEGATIVE,0.9778525829315186
8126,rescued,earth,migrants rescued boat capsizes libya,1,NEGATIVE,0.9562654495239258
8128,rescued,,young children rescued capsized boat libya,1,NEGATIVE,0.7464652061462402
8129,rescued,,heroes springer spaniel amp dog dad rescued stranded baby dolphin,1,NEGATIVE,0.873275876045227
8130,rescued,leeds uk,trust rescued dopey ones,0,POSITIVE,0.9988049268722534
8131,rescued,ireland,beached whales rescued kerry,1,POSITIVE,0.9845094084739685
8133,rescued,,rescued to goes ribbon hits,0,POSITIVE,0.9995511174201965
8135,rescued,,turn back rescued swept away sins clouds isaiah 4422 contemporary english version,0,POSITIVE,0.9675260782241821
8136,rescued,pennsylvania usa,pets like part family love animals last 2 pets rescued breaks heart animals mistreated,0,NEGATIVE,0.9050576090812683
8137,rescued,boston ma,liked video homeless dog living cardboard box rescued amp heartwarming,0,POSITIVE,0.9987809062004089
8138,rescued,canada,angry mistrustful rescued elephant finds peace friendship new home photos,0,POSITIVE,0.9433300495147705
8140,rescued,jakartakuala lumpurspore,photo hundreds rescued migrants await disembarkment irish naval vessel palermo italy,1,NEGATIVE,0.7061005234718323
8141,rescued,cape town,rescued med migrants arrive sicily,1,POSITIVE,0.9704071283340454
8142,rescuers,nigeria,video picking bodies water rescuers searching hundreds migrants,1,NEGATIVE,0.9751532077789307
8143,rescuers,westerland,video picking bodies water rescuers searching hundreds migrants mediterran,1,NEGATIVE,0.9836413860321045
8144,rescuers,kuala lumpur,video picking bodies water rescuers searching hundreds migrants mediterran,1,NEGATIVE,0.9836413860321045
8146,rescuers,surabaya,video picking bodies water rescuers searching hundreds migrants mediterran,1,NEGATIVE,0.9836413860321045
8147,rescuers,,video picking bodies water rescuers searching hundreds migrants mediterranean,1,NEGATIVE,0.9492728114128113
8149,rescuers,,fears missing migrants med rescuers search survivors boat carrying,1,NEGATIVE,0.9909272193908691
8150,rescuers,africa,rescuers searching hundreds migrants mediterranean boat carr,1,NEGATIVE,0.8442938327789307
8154,rescuers,,unexplainable desire watch rescuers,0,NEGATIVE,0.881078839302063
8155,rescuers,nigeria,fears missing migrants med rescuers search survivors boat carrying ma,1,NEGATIVE,0.9898372292518616
8156,rescuers,birmingham,channel 5 rspca dog rescuersthe infomercial crept back door,0,NEGATIVE,0.9977378845214844
8158,rescuers,,video picking bodies water rescuers searching hundreds migrants mediterranean boat carry,1,NEGATIVE,0.9599230289459229
8159,rescuers,,womanûªs gps app guides rescuers injured biker marin county,1,NEGATIVE,0.9697518944740295
8161,rescuers,,video picking bodies water rescuers searching hundreds migrants mediterran,1,NEGATIVE,0.9836413860321045
8162,rescuers,london,video picking bodies water rescuers searching hundreds migrants mediterran,1,NEGATIVE,0.9836413860321045
8164,rescuers,,video picking bodies water rescuers searching hundreds migrants,1,NEGATIVE,0.9751532077789307
8165,rescuers,,last second ebay bid it shaolin rescuers did 10 shen chan can chiang venoms kung fu favor,0,NEGATIVE,0.9975064396858215
8169,rescuers,,video picking bodies water bac news home rescuers searching hundreds,1,NEGATIVE,0.9945355653762817
8170,rescuers,thailand,video picking bodies water rescuers searching hundreds migrants mediterran,1,NEGATIVE,0.9836413860321045
8171,rescuers,,video picking bodies water rescuers searching hundreds,1,NEGATIVE,0.9760939478874207
8172,rescuers,17th dimension,amazing story power animal rescuers starving homeless dog future rescued person,1,POSITIVE,0.9997705817222595
8175,rescuers,,rescuers searching hundreds migrants mediterranean boat carrying 600 people capsized coast of,1,NEGATIVE,0.863865852355957
